"CommentID","UserDisplayName","CommentBody","CreateDate","Recommendations"
"14792651","Pat O","Why would you leave out the essential ingredients and declare this a success? Or, am I misreading your e-mail?","1509368008","3"
"14846597","Susan R","Because Greek yogurt is too thick and the consistency isn't right for a sauce.","1509369803","3"
"14859361","Samantha","One of the most delicious/easy ratio dinners I've every made! Subbed sriracha for the harissa and only used 1 tbsp  which resulted in the perfect amount of heat for me.","1509369888","3"
"14978314","D Demoney","This recipe was wonderful, but I think the oil in the marinade is superfluous, since the chicken thighs have enough fat in the skin.  Absolutely delicious, simple, and if you don't toss the arugula with the entire pan of chicken, works very well as leftovers","1509369280","3"
"15076335","Rose","Potatoes and arugula are lovely sides, but when I don't have them I make just the chicken with sauce and its Awesome!","1509369015","3"
"15150639","Rima","I'm serving this with Melissa's eggplant salad with peppers and feta vinegarette, also a NYT Cooking recipe","1509370284","3"
"16135664","Michael Indy","I have shared this with family and they all rave about it and have had it for dinner parties twice with the same results.  Excellent recipe!","1509374107","3"
"16222828","AJ","Used 1 TBSP less olive oil for the marinade + four chicken thighs + 1 large sweet potato and otherwise followed the recipe to the T. It was delish! I'd maybe make a bit more yogurt sauce next time. And I'm not sure why the recipe instructs not to use Greek yogurt; I did, without incident.","1509374784","3"
"18793496","Emily Melnick","Great. Tired of potatoe so we used parsnips and I wasn't disappointed. We aren't hot sauce fans but happen to have some Sriracha mayo hanging around so I used that. Still very flavorful. Leeks added a wonderful flavor.","1508876957","3"
"20239088","MLS","I see you used ""the honey"" in the marinate, however it is not called for in the recipe (at least not in the one online that I am looking at now).  How much honey did you add?","1508885179","3"
"21669806","Thomas Robson","Extremely happy with this simple yet very delicious recipe.<br/><br/>The harissa + cumin marinade has terrific potential for so many other dishes and cuts of meat! I'll be playing with that for some time to come.<br/><br/>If you have whole cumin seed in your pantry, it's definitely worth the little bit of extra effort to freshly toast and coarsely grind some for this recipe. You can safely increase the amount of cumin if you do this. Freshly toasted cumin is so mellow and sweet!","1506862802","3"
"25942143","Irina","I made this last night, without the arugula but everything else exactly as is and it came out AMAZING. Will add this to my regular rotation because it was delicious!! The harissa made it VERY spicy but the yogurt sauce was a good counterbalance to it. I also shredded in some cucumber into the yogurt and tripled the garlic, as I usually do.","1518535806","3"
"27917756","New favorite recipe. Ever.","Simply outstanding. I used whole legs which made a nice ""fancy"" presentation. Also, instead of ground cumin, I used whole cumin seeds which gave it a slightly nutty + exotic flavor.  I also ended up taking the arugula back off the top and tossing it in the bowl I'd used for the leeks to pick up all the leftover bits. I then served the chicken and potatoes on top of the arugula salad so it got all nice and wilted.   I could make this daily and die happy. Thanks Melissa Clark!","1532022595","3"
"30657719","Liss","I've made this incredible recipe with both chicken and, when making it for a vegetarian roommate, eggplant. If you're looking for a nice veggie substitute, it's delicious to use a large eggplant cut into thicker slices than the potatoes, marinated exactly as you would the chicken. It's so good!","1550344948","3"
"30917025","mary kaltenbach","This recipe is delicious. The mixture of flavors makes it extraordinary. I would make it for family for friends for company. Delicious!","1551846548","3"
"31231142","Sheila","This is really delicious. I made one minor adjustment - I added the lemon juice, dill, and olive oil to the yogurt, I love savory yogurt sauces.","1553555897","3"
"131148732","VHackman","I've made this recipe many, many times, because it is so good. But we find that using bone-in thighs with skin makes a huge difference...from really good (using boneless, skinless thighs) to absolutely fantastic! The chicken skin provides fat that makes the potato slices extra crispy and flavorful. Well worth the extra calories.","1707865699","3"
"131660788","tracy","I have made this many times over the years. It never fails to please. It’s easy and delicious. A great casual company dish because you can do other things while it’s in the oven.","1709741086","3"
"132094035","Richard X","So you didn't make this recipe.","1711407726","3"
"16425128","Caitlin","Great recipe. I don't like a pure yogurt so I substituted with Melissa Clark's tahini yogurt sauce from a lamb meatball recipe. It was a perfect compliment to the harissa.","1509375326","2"
"19215304","Odile","Greek yogurt is too thick and looses its ""bite"" compared to regular yogurt and which is important as a side condiment.","1508880967","2"
"19400140","Dana","Great recipe. Read through other comments and only added the leek mixture and arugula (the arugula under the chicken pieces) when there was 20 minutes left.","1508882811","2"
"20152741","PJ","I just made this for friends, and it was outstanding. It was very easy to make earlier in the day, and then simple to bake while we were enjoying wine before dinner. I served the chicken and potatoes over the arugula, and all the flavors came together very nicely. I made 4 1/2 pounds of chicken and 4x the marinade recipe, I used Greek yogurt but cut it with some milk, and it was a really bright, flavorful meal. I'll definitely make this one again","1508885634","2"
"20181839","Allison","I have made this several times and this recipe is a keeper. I use Sriracha and put the chicken in a bag with the honey, olive oil and cumin. I do not put the potatoes in the Sriracha marinade. It has a nice, easy kick and the sauce provided a good balance. I do not have good luck finding leeks so I roast regular onions with the potatoes. I have let the chicken sit much longer than 8 hours and it was still delicious. My partner loved the sauce.","1508885640","2"
"21267589","joyce","If the arugula is mature, I put it under, but if it's baby arugula, I wouldn't do that. The freshness of the arugula adds another layer of flavor and texture.","1508857360","2"
"22487326","Carla","I enjoyed this recipe made with boneless, spineless chicken thighs","1506867666","2"
"24091999","Ryan","This has become a staple for me. Dead simple, really tasty, and is great for myself (excellent leftovers), or when having a few friends to dinner.","1508764054","2"
"25038951","Sanjana B","I love this recipe! I use Trader Joe's Harissa, and season and cook the potatoes (I add brussel sprouts) separately. I also make a tzatziki sauce to go with it, but the yogurt sauce listed here is great too if you want a lighter flavor. I like to finish it off in the broiler for an extra char. I followed the others' recommendations and plated the hot food on top of the arugula, so it was perfectly wilted. A quick and easy recipe that I'll surely make again.","1512095978","2"
"27244323","dee kap","Great recipe. My personal preferences / adjustments were: - grating the garlic seemed unnecessary - easier to mince or make a paste in a hand blender and mix it in. I’d also use more garlic (3 cloves) if you want the yogurt flavor to be less yogurty - less oil - not sure why all that is necessary, skip it as a drizzle too - just use lemon juice - again, no need to grate - chicken amount seemed odd so I just went with what I had and adjusted the other ingredients accordingly - use more sriracha","1527479255","2"
"27729160","Sky","One of my go-to weeknight dinners. My kids love it. Highly recommend. Also great with sweet potatoes and/or other root veggies in the winter.","1530667246","2"
"27863327","gerry","Throw the arugula UNDER the chicken & potatoes after you take the pan out of the oven and it just wilts and absorbs the marinade and chicken juices. Mmm.","1531756073","2"
"27866759","Lee","I would love to be your dinner guest.  You sound like a truly imaginative host!","1531764788","2"
"27999004","Ann S","This was the best chicken recipe I've made in a long time.   I did not include the potatoes, and it was still fantastic.  The leeks were deliciously caramelized and crispy. The chicken was tender and flavorful.   This will be my new go-to! Leftovers were amazing in the following days.","1532538783","2"
"28917991","Gordon Capern","I loved this recipe.  The second time I made it, I dialed back the harissa a bit.  I preferred it that way -- loved the heat, but a bit too much for my Nordic palate.","1538828306","2"
"29196533","RachelM","A-ok the first night, but spouse and I almost fought over the leftovers-- it was so much better the second day once the flavors melded. Used chopped boneless skinless chicken breast-- briefly marinated-- and used Greek yogurt thinned with lemon juice as the finisher (raw garlic is a non starter here). Just harissa potatoes and lemon yogurt is a winner. Next time I'd roast potatoes for 15 min before adding chopped chicken breast and leeks.","1540763058","2"
"29884931","Rosie","One of my family’s favorite chicken dishes. I use on the bone chicken breasts and separate the chicken and potatoes on two sheet pans.  Potatoes get crispy that way. Serve over arugala with the yogurt sauce. So yummy!","1545695294","2"
"30040874","K","My mods added to effort, but worth it, imo...  whenever I do chicken thighs I “pre-braise” at 300 degrees, covered, for about an hour.  Otherwise they’re never done to my liking.  Anyway, did that with the marinated thighs, then separated the juices from the rendered fat and tossed the potatoes with the fat and roasted them separately.  I used the juices to baste the thighs and leeks.  When potatoes were browned, added them to thigh/leek pan to finish the process.","1546904178","2"
"30933560","Barbara Gentry","Excellent recipe!! I had arugula in the fridge that needed to be used, and not much kitchen time. Used sliced shallots & onion (no leeks on hand) and dried dill (same reason). Used sriacha instead of harissa. Otherwise, followed the recipe. Next time, I'll be sure to use fresh dill and try the harissa (with luck it will keep forever like sriacha?). My favorite Bulgarian-style yogurt (White Mountain) was perfect - just enough tang. Delicious!!","1551927730","2"
"100853072","Diana","Good. Used boneless thighs, trimmed of fat. Cut potatoes in wedges. Used 1 T sriracha, plenty hot. Only added leeks last 15 mins. Placed arugula on serving platter, covered in cooked chicken/potatoes, added lemon juice and chopped dill. Topped w/yogurt sauce made with chopped garlic, dill, s and p.  Really tasty. Thanks to previous posters for their suggestions.","1559960573","2"
"117375390","Chris","Made this with Greek yogurt. It was delicious.","1647303429","2"
"122768834","Kristen","Cooked this tonight and my husband said it was one of the best things I've ever made. I used chicken breast instead of thighs (just had them on hand)- 425 for about 25 minutes, adding the sliced leeks around the 10 minute mark. Made my own harissa paste (harissa powder plus olive oil and garlic). Served on top of the arugula with the yogurt sauce (extra garlic, no dill (store was out) and I used Greek yogurt), squeezed a bit of fresh lemon. This is going in our regular rotation.","1674605272","2"
"131036472","puree for smoother sauce","Sub carrots for potatoes","1707440596","2"
"131175625","Ernie","Really, really good. Didn't have harissa on hand so subbed half siracha and half peri peri sauce (Trader Joe's). Followed other reviewers and added lemon juice and dill to the yogurt sauce (used plain greek yogurt). Also added some smashed garlic cloves in with the leeks. Total cook time for me (with a mix of thighs and drumsticks) was 40 minutes. Did just chicken and potatoes for 30, added the leeks+garlic for the last 10. Serve everything over bed of arugula. Will make again!","1707961423","2"
"131661318","Kathleens","did anyone use sour cream, thinned, rather than yoghurt?  I hate yoghurt!  Kathleen","1709741821","2"
"131661468","Gordon Hamnett","We have been enjoying this recipe for a couple of years now as part of my regular recipe rotation. Although I love ""heat"", my wife is not a fan so I use ""mild"" harissa and the recipe retains all the flavor without the ""heat"".  EXCELLENT RECIPE!","1709742016","2"
"131661795","Terri Thal","*Very good. Had to substitute spinach for arugula and am eager to try when I have arugula. *Mix about a tblesp chopped dill into the garlic yogurt sauce and add a squeeze of lemon juice. * Put the hot chicken and potatoes on top of room temperature arugula and we had perfectly wilted greens, and no soggy left over greens. .","1709742488","2"
"131675882","Cathryn","Just okay was the common response in my family. We hoped for so much more given all the comments. The bar was pretty high. Didn’t meet expectations.","1709773849","2"
"131676583","BSD","Really good. Really simple. Make this.","1709776248","2"
"131739200","siehomme","I'm all in with this recipe. It takes my humble chicken-olive oil-potatoes-garlic sheet pan meal and elevates it without that much more work. The easy garlic sauce is the chef's kiss of the dish. Used gochujang instead of harissa because the tub was staring at me, bereft, from the refrigerator shelf. I heated the sheet pan before adding the potatoes (put in the potatoes 10 minutes before, thanks all) and they got nicely crispy. Also followed others in putting in the leeks 15 minutes before.","1710022495","2"
"131742449","Jessica","Delicious! This recipe got raves from everyone who ate it. I used sriracha, boneless skinless breasts and baby spinach as substitutions. I took the suggestion of some other readers and put the baby spinach under the chicken at the end, also mixed the lemon and dill directly into the yogurt (served on the side), and put the potatoes in at the end of the marinade. I used tiny little new potatoes, so did not need to slice or wedge -- perfect!","1710056086","2"
"132017938","caroline","Double the chicken","1711055035","2"
"132134194","hundmutti","I am shocked that man who had a grease fire used WATER to extinguish it.  That could have led to a disaster. Q","1711547190","2"
"132214649","Leland","yes, unpeeled","1711849768","2"
"132252026","Mary","This is a lovely dish. I am glad I read the comments first. Cooking the potatoes for a few minutes (ten) before adding the chicken gives them a nice, crispy finish. I put the leeks in for 15 minutes at the end; they were soft and still had lots of flavor, not overcooked. I seasoned the yogurt with dill and lemon. This is a perfect, casual, dinner party option.","1712013206","2"
"132298323","Benjamin","I will be making this again. It was so good. I used half potatoes and half fennel cut into about the same size chunks. Next time I honestly might just use only fennel and have a baked potato for the side if I'm craving a potato. While the potato was great in the dish, the fennel had this wonderful artichoke like texture and nice nuttiness. I also chopped up the fennel tops and blended them into the yogurt as a sub for dill.","1712176714","2"
"132350717","Michael Winters","add some sliced cherry tomatoes for color and to compliment salad.  Also, a few black olives or capers add a nice sour compliment","1712352265","2"
"132545035","Catherine","So delicious! Got distracted chatting and drinking wine and forgot to add the leeks…once the chicken and potatoes were done I removed them to a platter, added the leeks to the hot baking sheet and frizzled them in the oven for 10 minutes. Think I will do the same next time I make this!","1713145506","2"
"136283036","Paige","Where has this dish been all my life?  Hands down one of the best dinners I have ever made, and we are adding it to our list of ""easy and delicious dinners worthy of serving to guests"".  Used skinless breasts to make it (no points on Weight Watchers, whereas thighs cost points), and piled the chicken and potatoes on top of the arugula to wilt it per others' suggestion.  Used Greek yogurt for final drizzle--added some water to thin it.  Ridiculously delicious, beautiful presentation!","1726681454","2"