"CommentID","UserDisplayName","CommentBody","CreateDate","Recommendations"
"116836937","justine","Absolutely great. Changed nothing except extra carrot Did NOT find it watery at all.","1644451930","3"
"118432458","Stevie’s Mom","Wasn’t as thick as I expected even after use of immersion blender.  I’d add more lentils next time vs reducing liquid.  I added some fresh spinach I had on hand.  Served with a dollop of home made yogurt which was quite tasty.","1653174096","3"
"119807114","Mimi","Made this with a home economics class of 15-year-olds who all turned their noses up at the simple mention of soup. The concept of lentils brought out a whole other level of disgust and outrage, as did the lack of meat. Their looks of surprised delight when they tried it are part of why I love teaching this subject and why I love this soup. They all asked for seconds! This is the perfect soup to win people over, including sceptical teenagers.","1660252041","3"
"120872726","Istanbullu","Why is everyone suggesting to turn this into daal! It's not daal! It's Turkish lentil soup! It is its own thing and very delicious.","1665514609","3"
"127874335","Birch","So delicious I almost cried! Love squeezing loads of lemon on it. Took me back to a Turkish restaurant in Berlin. Fantastic panic dinner - who does not have a carrot and onion in the cupboard?","1695232830","3"
"127914025","Shirley","Absolutely delicious!  I made it for my daughter when she was sick one time and she had 4 bowls!  Now she takes it to any of her friends who are sick and need something nourishing and delicious.","1695354351","3"
"129405282","Lynn in Mpls","I just want to say that I am not a fan of lentil soup and I am not vegan, but I love Melissa Clark's recipes, so I thought I would give this a try. I read a lot of the comments and decided that I'd try it ""as written"" the first time. I am glad I did because I think it is perfect and delicious. It thickened up just fine. And, with all due respect to the folks adding other kinds of tomatoes, I believe the tomato paste is there to add umami and not to make this a lentil tomato soup.","1701135153","3"
"15212639","Helane","Have served this cold as well, if you plan on doing, up the spice a bit. Added guacamole and yogurt and its great, lime in place of lemon and the flavors are Mexican","1509371042","2"
"16396503","Carol King","this is a great recipe. i made some refinements based on what I had in the cupboard - using ketchup instead of tomato paste and not adding a carrot or cilantro. i served this to guests, who really enjoyed it.","1509375405","2"
"16685336","twanza","Fast and fabulous; the lemon juice makes it perfect.","1509377210","2"
"16687800","Lisa","Well huh.. when I saw the ingredients for this recipe I was hesitant- didn't look like there would be a lot of flavor to this soup, yet there were all these rave reviews. So I caved and made it. One word - ""unremarkable"". <br/><br/>My personal recommendation sub out the cumin/chili powder for  2-3 t. curry powder. After the lentils have simmered, add a can of coconut milk and the tomato paste- 3T. Heat through, add 1 T. butter (opt) and some chopped cilantro. Serve over rice. Oh yeah!","1509376825","2"
"16796786","Rudy","My grandmother used to add a spoon of mustard oil (I know it's banned North America) in the end to give the best zing! Also, don't forget the turmeric ...","1509377405","2"
"16864196","Linda","This is a recipe I share with friends.  It is delicious.  The lemon is essential to give it a sense of brightness.  I will admit to being lazy by not blending anything and using sun dried tomatoes in a jar.","1509379078","2"
"16868840","SCA","I make my version--daal--and it freezes just fine.  This type of recipe doubles/triples etc. easily.  I'll put two servings or so into those large Chinese takeout soup containers for freezing.  The frozen soup slides out easily into a pot if you run the container under hot water if you're in a hurry with no time to allow to defrost.","1509378609","2"
"16869091","Sally","My husband added leftover quinoa and thought it was the best lentil soup ever.","1509378310","2"
"16869415","Andrea","Delicious! I hate cilantro so I left that out. It tastes so good it doesn't need cilantro anyway.","1509378257","2"
"16888872","Sisters","Outstanding soup!  Used ingredients I had on hand (Ro-Tel instead of tomato paste and chile powder; extra carrots to use up some purple ones that needed to be eaten).  This was a fast recipe to make.  Doubled it so we have lunch for the week.  Never used red lentils before, but they're going to be used more in the future.  Serving it over orzo, with some Mexican-style shredded cheese on top.  YUMMO!","1509378273","2"
"16899073","Linda","I add some orzo to the soup to give it a bit more body...","1509379108","2"
"16919250","Benedetta","Very tasty. I added a bit of lemon zest, it adds flavour and freshness.","1509378131","2"
"16926959","johnenglish","I tried this last night with ""regular"" (brown) lentils. I started tasting at 30 minutes and I believe it was at least another 20-25 minutes before the lenails were cooked to my preference. Different lentils have different cooking times so intend to cook them for a while and taste, adding cooking time if necessary. Hope this helps.","1509378573","2"
"16935149","Divya","I really enjoyed this soup. I saved time by skipping the pureeing, and still had plenty of creaminess and flavor.","1509378828","2"
"16935169","elisa","this is my absolute favorite lentil soup!  i always have some in the freezer and add lemon after thawing and heating.  i don't puree because i prefer having texture. a great recipe!","1509379224","2"
"16936050","2Lulus","This soup has excellent flavor, it's hearty, reheats well and best of all it is easy to prepare.  I used vegetable broth.  I served it with hot corn bread and an arugula salad.<br/><br/>I followed the recipe as presented.  If you have a well stocked pantry then you have everything you need with the exception of fresh lemons and cilantro.  <br/><br/>Hmn, might try toasted cumin seeds next time.","1509379026","2"
"16936771","Georgia","I've been making this since the recipe first appeared in the Times. We don't like cilantro, so I substitute either fresh mint or fresh dill. It is completely delicious!","1509378447","2"
"16937820","Sherry S","Excellent. Based on several comments I used 1 1/2 cups of lentils and 5 cups of chicken broth, no water - I wanted a thicker soup. Used at least a full lemon, more chili, salt and pepper (added extra at end). Reserved about 2 cups and puréed the rest with an immersion blender. First time working with red lentils and I was pleased with the end result. (Do not judge soup until it is fully ready to serve - do not omit the lemon!)","1509379183","2"
"16938680","Regina","This is a fabulous recipe!!!!!!!!!  We loved it and are already planning on eating it next week.  We didn't add the lemon and used parsley instead of cilantro (I can't stand it!). And served it with killer Acme Olive Bread, mission fig balsamic and olive oil and it was divine!","1509378941","2"
"16939579","John","Yes! I also love whole pan-toasted cumin seed in some recipes added at the end, and you don't even have to crush it, just leave it whole, and its super crispy and gives those little bursts of cumin when you bite into them.","1509379077","2"
"16942317","Tom","Like so many others, we really loved this. Cheap, nutritious, and very tasty. I used 1.5 times as many lentils as called for, and it seemed perfect. Since it was dinner, like some others are doing I added a medium potato (yukon) diced the same size as the carrot (about 1/4""); very nice. Ladled out about 1/2, blended remainder with immersion blender, added the other half back with the lemon and cilantro, along with more salt. So simple, and so delicious.","1509378460","2"
"16943079","mem_somerville","This was very tasty, with a nice color and texture. It also reheated well, which is important to me when making a pot of soup. It didn't separate or over-thicken. I also paired it with a crusty baguette and it was perfectly filling.","1509378641","2"
"16944326","Kim D.","I agree with the comment that there is too much liquid for the quantity of lentils, so next time I make it (and I will again, soon) will increase the lentils to about 1.5 cups.  Overall, an easy, delicious soup with lovely flavors and texture.","1509378615","2"
"16944699","Peter","addition of spinach, potatoes and garam masala sounds good.","1509378964","2"
"16973077","Ingrid","Very tasty, quick and easy. I thought when I read the recipe that 1 quart of stock plus 2 cups water sounded like a lot of liquid. And it is quite thin. I will probably cut back on the water or even leave it out next time because I would prefer it thicker.","1509378032","2"
"16992155","Judith Norman","I throw in sliced kielbasa at the end to make it a bit more hearty.","1509378344","2"
"17023747","Western Girl","Great flavors, especially with some additional NM red chile powder, but the soup was too thin.  Cut back on liquid or add more lentils and carrots - maybe some potatoes.","1509378292","2"
"17029731","Beth","Wonderful combination of easy to make and delicious! I felt the recipe was perfect--no tweaking needed.  I plan to make it many more times this winter.","1509378782","2"
"17031601","Leisureguy","I used 1/4 c lemon juice, and I skipped the blending altogether: red lentils are sell-puréeing. Very tasty.","1509378178","2"
"17038755","claudiajo","Easy to make. Delicious to eat. Freezes well. Agree with other reviewer no need to use blender. Red lentils get a bit mushy and add to the creamy texture of this recipe.  Yum! Thanks Melissa.","1509379209","2"
"17101404","Kathy Millard","I don't like to add oil to soup  at the end of cooking like this suggests: it always seems like trying to make-up for not getting the flavours right. Be sure your stock is hearty, if it is on the weak side, the soup will be tasteless. Water too, would weaken it.  Otherwise, it is a nice soup served with a dollop of thick Greek yogurt or sour cream. ( I doubled the spices after I read the comments.)","1508868963","2"
"17114107","Tracy","Agreed, I had some smoked kielbasa lying around and threw that in and it was a winner. Super delicious.","1508867440","2"
"17165621","Carol","Great recipe!  I increased the spices a lot--probably double.  Not sure the cilantro added much.  Lemon definitely did brighten it up.<br/><br/>Would consider adding a little red bell pepper to it at the end next time.  Also, more tomato paste and much more carrot, maybe two or three.","1508867864","2"
"17165781","SEA","Delicious!<br/>Used coconut oil and 2 additional cups broth instead of water.","1508868263","2"
"17171951","sherry edelstein","Yes mine came out to watery and good to see not the only one.","1508868858","2"
"17183264","sherry edelstein","did you get reply to your question?","1508868223","2"
"17193102","Meta","This was good (and easy) but didn't blow exactly blow me away. Took the advice below and used 1 1/2 cups lentils, 1/2 tsp chipole chile powder and added some kale at the end.","1508868128","2"
"17205708","Maggie","I adore this soup.  I add potatoes and a couple of chopped tomatoes, and substitute vegetable broth for the 2 cups of water, and the consistency is perfect...not too watery at all.   I triple the garlic, and use lots of chipotle chili powder.  I also puree half the soup right in the pot with an immersion blender.  Once I used regular lentils, and it wasn't as tasty.","1508868498","2"
"17212756","Kathleen","Definitely agree with the comments below re: using less water. I personally used the quart of broth per above, and instead of the recommended (2) cups of water, I added (1).<br/><br/>I also doubled the paste/salt/pepper/cumin/chile powder and added an extra minced garlic clove. <br/><br/>Lemon and cilantro add some really good flavor. Overall VERY delicious and will make again!","1508867650","2"
"17246536","MsBlucher","Aldi Markets (tangentially related to Trader Joe's, and expanding their locations in the U.S.) tend to have red lentils at a good price & in resealable bags; TJ's may well carry them too.","1508868763","2"
"17247654","MaryJ","Love this soup. Just a little extra tomato paste and lemon juice makes it even better.  I used chicken broth rather than vegetable broth, just because that's what I had on hand.","1508867902","2"
"17377914","Karen L Davis","Wonderful flavors! Used a 1t of chili powder rather than a pinch of either it or red pepper. Didn't feel the need for the blender step; the consistency was good after the 1/2 hour of cooking time.","1508868546","2"
"17384281","Frances","Great! As easy as promised and pretty quick. More flavorful than I expected - will definitely be my go-to lentil soup recipe. It gave me three servings, so I'll make 1.5 times or twice next time. Used ketchup instead of tomato paste since it was handy - didn't measure.","1508868704","2"
"17393202","SallyH","Delicious flavor, with the bit of lemon. I added a handful of raw spinach at the end for added nutrition.","1508868306","2"
"17482973","H","What a wonderful soup! A surprising delight! I added smoked paprika and a dash of worcestershire. Will definitely make again.","1508869861","2"
"17582180","Lucinda","PS Did not blend","1508870732","2"
"17583211","Kristin","I love this soup! I made it just as the recipe says, and found it very filling despite the delicate texture.","1508870146","2"
"17751006","Naomi","I have made this soup several times now, and it is great every time. The sourness of the lemon is delicious in combination with the sweetish tomato. The generous olive oil drizzle is a must. Fantastic recipe.<br/><br/>Some changes - I usually don't have broth and the soup powder that I used to use is full of MSG, so instead I doubled the amount of taste makers: double tomato paste, cumin, pepper and instead of chili powder, paprika powder.","1508871215","2"
"19488159","Nonorexia","Melissa's recipes are the BOMB! She's my favorite Times food lady. This is going to be a classic in my winter regime, alongside Craig Claiborne's chicken recipes and Marcella Hazan's ragu all bolognese! The Times should have a network and put her on her own show.","1508881683","2"
"20104502","Nina","What you're describing sounds tasty, but it's a completely different recipe. Personally I think this recipe is great the way it is.","1508885984","2"
"20580688","Laura Ann T.","This was delicious! I almost couldn't believe how good it was because it's so incredibly simple to make. The only things I added were some celery with the onions/garlic and then some spinach at the end, both of which needed to be used before the holidays. It seems like any veggie could be added. Sauteed mushrooms would be a great add in.","1508886763","2"
"21661678","Julie","I followed most of the basic recipe but added the following additions and changes.<br/>I browned the onions, carrots and the garlic together.<br/>I also used 1 can of diced tomatoes instead of tomatoe paste. I  added 1 tsp of ground coriander seeds, and 1/8 tsp of ground chipotle spice.<br/>I did not puree the soup as It was not necessary. The consistency of the<br/>soup was very good and it was very flavorful. With the leftover soup I plan to saute some ground sausage and add it to the soup.","1507131717","2"
"21695362","Harry","I make this soup all the time. My favorite twist is to get some Alaskan cod bits at Trader Joe's, toss them in a bowl and put the same spice mixture on them and let them sit while making the soup. 15 minutes before the end, toss them into the soup and let them poach. It's really quite delicious.","1507131975","2"
"21765795","Bets jepsen","I added more carrots add celery & sautéed both with the onions garlic. I also used better than bullion vegetable stock yum.","1506863016","2"
"23121615","will fiveash","I made the basic recipe except for adding a diced potato as suggested in these notes and I used smoked paprika instead of cumin. So good!","1506874575","2"
"23969652","Nancy Campbell","Daughter made this soup for us the first night my husband & I arrived in Belfast, N. Ireland from CA; it was delicious, satisfying and much appreciated!  She used leftover clay pot chicken broth, and store bought chicken broth to =  the amount of broth called for in recipe and 1 cup of water. Before serving, she added leftover shredded chicken & topped each bowl of soup with a dollop of creme fraische, grated Irish cheddar cheese and sliced avocado.  TY Shelley! This recipe is a keeper!","1508764060","2"
"24362490","Diane","This is a terrific recipe. I added ras al hanout and a preserved lemon. Delicious! ","1507434693","2"
"24865174","Jocelyn","Love this recipe--I have gone back again and again for its simplicity and adaptability! It's yummy as is, but I had stuff to use up... was craving tomatoes, so I added organic san marzanos (liquid squished out 1st & reserved for something else)... plus big chunks each, chopped, of ginger and turmeric roots (no chili or cayenne; just the cumin). Used butternut squash instead of carrots and it is DIVINE.","1510863139","2"
"25264414","Lea","Pressure-cooked 10mins in instant pot = perfect.","1513614327","2"
"25324010","DK","Based on readers' comments:  double carrots and tomato paste. Increase garlic and spices. Either cut amt. of liquid or add a potato to increase thickness.","1514041174","2"
"25352444","Roberta","Have made this so many times, most often for myself, but also for company and have yet to find someone who does not like it. It's great to heat up all week for lunches, or to serve all at once at a dinner party. I have never blended it because it is the right texture for me without doing so. This is one of those recipes that is easy to make anytime because I usually have the ingredients on hand in the fridge and pantry.","1514398170","2"
"25457427","Jajalondon","JUST MAKE IT! It's terrific. In the saucepan in under 15 minutes, plus bread, cheese, some green salad, and you're done! I've been making this all year.... so have my daughter, daughter-in law , friends. While it's cooking, you could pop Marian Burros' plum (or other fruit) torte in the oven: another brilliant 15 minutes make. And you have a perfect casual supper. (And you can use parsley if folk hate cilantro.)","1515270456","2"
"25545059","Emily","I read all the other comments and followed everything-  Added: 2 extra carrots 1 can stewed tomatoes 2 extra cloves garlic doubled the spices half a can of tomato paste lemon zest smoked paprika  Skipped the water as there was plenty of liquid.  AMAZING!","1515784654","2"
"25889955","Jody Forman","I added:  3 stalks of celery, chopped; 2 small potatoes, diced and the juice of a whole lemon.  Yumm!","1518142591","2"
"26552473","Alyson","I've made this several times; it's such a lovely and simple recipe. I cooked it on a Sunday and took it to work every day this week. It tastes even better the next day and the day after that.","1522471275","2"
"26797573","Michele","If you are looking for a bright, lemony red lentil soup, this won't disappoint.  I make it with homemade chicken stock, more than a pinch of cayenne, and double the amount of garlic suggested -- 4 big cloves -- and serve it with lemon slices and yogurt.  It gets better each day!","1524157377","2"
"27000577","Gail","I added fresh ginger to the step with the onions, doubled the cumin and added some smoked paprika. Didn't bother to puree. Added a pound of mild cod. This was delicious! Loved the brightness of the lemon and cilantro. This will be a keeper","1525709289","2"
"27055698","Rob","Also, because I only did a can of chicken broth, it needed a lot of salt. I would double all the spices and let simmer the full time for depth of flavor.","1526014642","2"
"28617035","Texan who moved to Paris to stay Seine","This is a tasty, hearty dish for once it turns a little cooler.  I never make it exactly the same because I add unused veggies found in my fridge. Only had scallions, so used those instead of a large onion. I also only use my homemade veggie stock (yay, instapot) instead of water. I sprinkle coarsely broken dried pumpkin seeds over this to add yet another bit of consistency character.  I've made this at least 4 or 5 times and it is always a hit.","1537044380","2"
"28695644","Abby","Freezes well.","1537552496","2"
"28972974","Kim","This is very good with a sprinkle of za'atar. and a spicy olive oil.","1539195924","2"
"28977476","tracy","I love this soup. It is light yet hardy. I add a can of diced tomatoes and fresh spinach before serving. ","1539229526","2"
"29236386","Jane","Made as-is but added chunks of poached chicken near the end. It''s so delicious. We've had it several times.  (Poached chicken with aromatics)","1541004477","2"
"29280203","MikeIdaho","I tried this recipe this morning. It turned out delicious. I followed suggestions in the Notes, i.e., add a potato, 2 carrots, 1.5 cups of lentils. I used my electric pressure cooker. I added cherry tomatoes in addition to Cento tomato paste. I also fried an egg and put it on top of the bowl when I served it. I will make this again!","1541346762","2"
"29341039","Emily D","This is delicious simple soup! I eliminated the cumin because I was not in the mood for it this evening- instead I used sumac, and red pepper flakes instead of cayenne. I had a small leek and half an onion in the fridge so that was another minor change. My homemade chicken stock was pretty dark so my soup didn’t come out the lovely orange color. However, it is sooo delicious. I love Melissa Clark’s simple flavorful recipes. ","1541723206","2"
"29397947","Burt","Made a double batch. Added 8 small red potatoes, all of a small can of tomato paste, and a 28oz. can of crushed tomatoes. Also fried up 5 strips of bacon cut into lard-ons. Used as garnish and used the grease to sauté onions, etc. Delicious!","1542165379","2"
"29556013","Erin","OK but kind of bland - had to add tons of salt. Added tomatoes","1543451336","2"
"29588569","added","Add 1 teaspoon hot curry powder","1543697883","2"
"29589526","Joris","Only use 4 cups of liquid total for a thicker dal like texture","1543709202","2"
"29602400","12/3/18","Great, added coriander and used diced tomatoes instead of water. Can basically add anything ... also could use more garlic, tomatoes paste, etc.  ","1543852830","2"
"29872731","Blue Jay","Added cooked rice, celery, and corn kernels. Also ginger and a little ground coriander.","1545613306","2"
"29899584","Julia","Love this recipe.  I've made it about a dozen times and have found that the ginger is a must!  I make it with homemade chicken stock if I have it, but don't add the extra water as it makes too watery.  I also add a dash of paprika and scant bit of cayenne sometimes.  This recipe comes together so quickly and everyone loves it.  I serve it over rice too.  ","1545852457","2"
"29922127","Nicole","Like other commenters I added a 14 oz can of diced tomatoes and diced medium potato with the carrot. So delicious and easy and probably freezes well. ","1546018084","2"
"29932354","Becky E.","Love the recipe but also found it too watery so I doubled the lentils and it came out fine - nice and thick. Next time I'll just leave out the extra water. I cooked it so long I didn't even need to use a blender to puree the soup. The lentils fell apart but the diced carrots held their shape.","1546105054","2"
"30005680","bonnie","Great.  Added toasted cumin seeds, Aleppo pepper, chopped cauliflower, more garlic, lentils, carrots, tomato paste.","1546654904","2"
"30026022","BB","This was an easy, quick soup. I followed others' suggestions and used an extra carrot, double the garlic, and 1/4 cup more lentils. The soup was still a tad thin to my liking, even after cooking it with the lid off.  would probably skip one of the cups of water next time. It needed a lot of salt and a full lemon of juice. The cilantro makes a big difference.","1546824484","2"
"30129217","Jennifer","This has been my go-to soup recipe for a while. It’s easy, fast and delicious. I use water rather than broth and don’t bother with the carrot which simplifies the ingredients list.  And I also use a small can of chopped tomatoes or even fresh sliced tomatoes instead of the tomato paste.","1547367685","2"
"30137634","susan","Cook red lentils Ahead.  Wonderful flavor but lots of time needed to get dried red lentils to be soft.  1/12/19","1547425553","2"
"30169125","courtney m","i totally forgot to put do steps 4 and 5 (and did the rest in the instant pot) and it was still so tasty. excited to actually include the lemon/ cilantro / fixins  for a whole new experience! ","1547575419","2"
"30352326","BDWoolman","Great recipe. Salt well.  Try adding a small peeled potato (twice as big as a golf ball) at same time as the lentils for a velvety texture. I blend all smooth. Stir in some kefir or sour cream when serving.","1548600415","2"
"30353647","Julie","This is a great soup! I followed the suggestion of doubling the recipe while reducing the water somewhat--sometimes I use water only and no stock.  I also used canned roasted tomatoes instead of tomato paste, and added some diced ginger root and some ground coriander.  No need to liquify this soup, in my opinion.  ","1548605457","2"
"30355923","Isabel","I added a tblspn of finely chopped spicy pancetta. It adds another layer of flavour. ","1548615908","2"
"30356140","CSW","This truly is a great soup recipe! To add some protein, nestle hunks of cod loin in the soup to gently poach for five minutes or so before serving. Delicious! ","1548617324","2"
"30356208","Shannon","Thought this was perfect and delicious. Only change was that I used vegetable broth instead of plain water. One of the best soups I have made and freezes great to pull out for any easy weeknight meal. Served with toasted baguette. ","1548617679","2"
