"CommentID","UserDisplayName","CommentBody","CreateDate","Recommendations"
"116427518","Sacodo","I made this soup with cornflakes, three eggs, a tablespoon of honey, challah bread, and maple syrup. Kinda tasted like french toast but it was great! Delicious!","1642462678","6"
"16964512","Anne","Add more lemon and add spinach; did use potato; maybe try corn","1509378537","5"
"17092567","Frank","Fantastic recipe. Very similar to the Dal variation that my Mom whips up.<br/>I would definitely recommend a green chilli, however, to add the requisite kick.","1508867454","5"
"20615692","James Ferrell","This is very similar to my favorite lentil soup recipe, which I got from The Week (magazine). The only difference is that The Week called for pan-toasted cumin seeds (toast on the stove in a small frying pan, no oil, until the seeds start to pop) rather than ground cumin; I have made it both ways and prefer it with pan-toasted cumin seeds.<br/><br/>It's a really delicious lentil soup, quick to cook and lighter in flavor than most dals.","1508886853","5"
"25638910","Mary McCue","In Turkey, this is called mercemek corba, and you add dried mint instead of cumin. Easy, nutritious, and delicious!","1516497337","5"
"26492871","Danny F","This was deliscious, simple, and fast.  Total winner for winter weekday dinner.  I made the following changes: -Used 5 C. chicken stock and 1 C water -Used 3 T. tomato paste -Added smoked paprika -Added 8 oz fresh spinach at the very end -Added lemon zest too  There's really no need to blend the soup at the end.  Red lentils fall apart if you cook them long enough.  Simmering an extra 10 mins or so does the trick.  Absolutey do not skip the lemon juice and the end.  It's esential.","1522112637","5"
"29483467","Margot","This is a standard recipe in our house--quick and easy, with endless variations possible.  I add more root vegetables (haruki turnips and beets along with the carrots), double the recipe, and vary the spices (garam masala is a good add).  It's also excellent with a dash of coconut cream (or a whole can) mixed in at the end, and garnished with kimchi and any fresh herbs you have on hand.  Yum!","1542815884","5"
"29612611","filofilia","Great detox soup. MGJ loved it.    ginger (roughly same amount as 2 large cloves of garlic)  1/3tsp chilli powder—gave kick. Could do less, add hot sauce?  950ml broth 450ml water 3 carrots 3 handfuls diced tomatoes—had fresh and Ocado frozen... otherwise add can of diced and reduce water some.   Immersion blend incompletely. ","1543907126","5"
"29767790","Victoria","Cannot day enough about this soup! Easy, healthy and so so delicious. The mint oil is a fabulous addition, but a drizzle of plain (good) EVOO and fresh herbs would be a fine substitute. Melissa always nails it!","1544974656","5"
"29770324","Substitutions - made 12/16/2018","Substitute 2 vine tomatoes, diced for tomato purée 5 small carrots, diced 2 teaspoons of Garam Masala seasoning  1 teaspoon of chili powder w cumin, garlic and oregano Substitute 4 cups water for quart of stock  ","1544997535","5"
"29771932","Gwen","This is wonderful. Made a few changes per recommendations of reviewers. Used 1 qt beef broth, no additional water.  Added 1/2 can diced tomatoes, bit of ginger, 2 small yukon gold potatoes plus more salt and pepper.  Did not use cumin or chile powder.  Also did not puree any of the soup.  The lemon juice and cilantro to finish are a MUST!  Did not drizzle with olive oil or chili powder. ","1545016863","5"
"29974112","BJKELLY ","I like a pinch (or two) of cayenne. Also, often I add diced up potatoes (especially if you like a thick soup) and almost always stir in some fresh spinach for an extra veg and full on meal!","1546482556","5"
"30033028","Jane","This needs about 50% more lentils to be substantial. Herbs and spice need to be increase to compensate.  Otherwise, fast and good.","1546881083","5"
"30038461","Andrea","It was a good recipe, but definitely needed more body. I added an extra 1/2 cup of lentils and I thought it couldn't used more. I also doubled the cayenne and added red pepper flakes. Needed a kick!","1546895561","5"
"30122338","Taylor","I use a similar recipe. In answer to those who wanted more “body” or thought soup was  “Thin”, omit step 4.  ","1547314352","5"
"30140096","Peter (From Germany)","I use Hokaido pumpkin. I replaced the tomato paste with red chilli paste","1547464060","5"
"30142026","Eva ","I love this soup! It is simple to throw together and delicious. And it is Weight Watchers friendly!","1547472605","5"
"30156729","Bethann","I loved this recipe! Simple and delicious. I upped the amount of Cayenne pepper because I like the spice. I also had a red bell pepper kicking around, so I chopped it up and sautéed it along with the onion and garlic. ","1547517062","5"
"30158118","D","I’ve made this twice in the slow cooker. I cook all ingredients except lentils on high for one hour. Add cup of lentils and a pack of diced ham. Cook about two more hours. Use immersion blender, add cilantro, lemon and oil at the table and done. Spouse loves and I’m not sure spouse had eaten lentils before this. I cut fresh garlic by half. Definitely on the winter menu rotation. ","1547523516","5"
"30262691","Sarah","Hi, how long did you cook in instant pot for? Thanks! ","1548117342","5"
"30353571","Golem18","I followed the suggestion of several commenters to add a half cup of  lentils.  I disagree.  The result was like thick oatmeal sludge than even a thick soup and I was forced to cut the result with water. Make it according to the recipe the first time then decide if it's too thin - it can be reduced.  It is an excellent tasking soup and I've portioned into single servings which I froze.  It lends itself to adding bacon, slices of sausage (Merguez lamb), scallions, pickled mushrooms, or leftovers.","1548605094","5"
"30355748","Jasmine ","A dollop of plain/greek yogurt or sour cream at the end adds a tangy creaminess which balances with the lemon, and dampens the heat for those less into spice","1548614926","5"
"30355952","Anne M.","This soup is fantastic... even better with some sautéed eggplant blended in for ultimate creaminess!","1548616112","5"
"30356500","Shannon "," Yes I always make about twice as much and freeze it. It’s fantastic the second time around  ","1548620179","5"
"30356515","Willie","Cold (53 F) and rainy in Central Florida this winter day, so I whipped up this soup to warm our bones. Absolutely delicious and simple. It was fun to riff on the basic recipe with additional spices, like turmeric and coriander. Mopped up with warmed pita bread served with a side of Mark Bittman’s hummus recipe. We got our protein and fiber this afternoon!","1548620262","5"
"30357552","Jeannine Bartel","A few slices of avocado in the finished soup are delicious! I also agree with those who added a cup of coconut milk for one of the cups of water.","1548633569","5"
"30357937","Jessie","Half is probably not an exact measure -- just approximate or blend to your taste. Do you chunkier or smoother? ","1548638059","5"
"30371499","CINDY","Instead of the lemon acid note, I typically use vinegar. ","1548720127","5"
"30379840","Steve","I add chopped dried apricots or peaches, and typically don’t use cilantro. The apricot pieces add a nice touch of sweetness.","1548773142","5"
"30388564","Jorge","Made it twice; first time following the recipe to the letter. Second time, instead of two cups of water I used one cup of broth and I puréed the whole pot. Both were excellent but, to my taste, the first time around was a bit thin.","1548797856","5"
"30394032","carolek","I always add a cup or so of diced ham to lentil soups. It adds something and makes it heartier.","1548849419","5"
"30394925","John G","I have made this soup many times, but I always increase the amount of carrots, tomato paste, and cumin. ","1548854660","5"
"30397864","carole","There is a Turkish restaurant in my town with the most divine red lentil soup.  This recipe is a very close approximation to the Turkish one and I am thrilled beyond words to have this; I've made it many times and it is one soup I make usually once a month in colder weather.  Yum.  I have a pot of it just finished and ready to eat.","1548865022","5"
"30403853","Meredith","This is a very good recipe. As is, I really liked it by increasing the amount of spice and lemon juice to taste. I've had this soup in restaurants where it has a more lentils and is completely smooth, so that's my preference. I doubled the recipe and next time I make it, I'll do three cups of lentils instead of two and fully blend with the immersion.","1548883474","5"
"30558752","Greg","Just a great recipe, with excellent flavors. Very versatile. Lemon is critical. Want it thicker? Reduce the water. Different dimension? Add sour cream, or float croutons or avocado slices. Thanks Melissa!","1549846421","5"
"30931646","becky","Instant Pot- 6-10 minutes on soup mode","1551917099","5"
"31249725","scottbenimble","I make this all of  the time as is and it’s absolutely the easiest, best, and most rewarding soup I’ve ever had. Sure, try variations, but’s it outstanding as written.","1553638637","5"
"31448221","JoanC","A revelation.  I can't believe how delicious this is, with minimal effort.  Made as written except I added one cup of water instead of two and was pleased with the thickness of the soup.  The lemon juice and cilantro are absolute necessities - don't skip them - they round out the flavor.  I'll be making this again for sure.","1554766475","5"
"107469462","David B","This recipe is for people who do not like flavor. It has about 1/4 of the seasonings it needs to have any taste at all. Maybe it would work in a nursing home, but not for people who want flavor.","1591482207","5"
"16245097","Paige","This soup is extraordinary. I made it exactly as written except I forgot to add the chili powder and used a miso stock (2 generous T chickpea miso dissolved in 4 c hot water) in lieu of veg or chicken stock. I can't believe how bright and complex the flavor is. Delicious fall lunch!","1509376320","4"
"16807402","Chas","Very good results but I did punch up the flavor a bit.  Increased the amount of cumin to at least two teaspoons.  Added another teaspoon of chile powder, a pinch of curry powder.  Doubled the tomato paste to two tablespoons.<br/>Doubled the salt to almost a teaspoon of good sea salt. (Kosher salt--really? read what Mark Bittman says about the stuff.) Added a teaspoon of soy sauce to add umami.<br/><br/>The chopped cilantro and lemon juice really add a nice flavor.","1509378883","4"
"16868546","Passion for Peaches","I make something similar: use mushroom broth, add a third of a cup of barley to the lentils, and then stir in chopped spinach at the end to wilt, and finish with a splash of sherry vinegar.","1509378136","4"
"16870645","cz","Saved this recipe when it first was published and make it on a regular basis. (Had it for dinner tonight, in fact!) It's easy and very delicious. Be sure to add the lemon juice and cilantro at the end for added flavor and I found it needed a bit more salt to taste.","1509379220","4"
"16879636","Robin","Nice. Next time will only add 1 cup water... but certainly will be a next time.","1509379222","4"
"16920270","Angela","Came out great, was easy to make, and definitely was easy on the pocketbook! Added a half cup more lentils, based on previous comments about being too watery. In the future, I may add lamb sausage and kale/chard/spinach at the end, (and forego blending half) for a heartier meal.","1509378597","4"
"16935161","Carrie","Love this soup! Froze small serving sizes in paper cups--great for lunch--microwave 3-4 minutes or so to heat up.","1509378932","4"
"16937522","Matt","This sounds yummy, and very similar to a Turkish red lentil soup that uses lots of dried mint, instead of cilantro, and paprika instead of cumin.","1509378273","4"
"16937554","CR","I make this ALL THE TIME and just enjoyed a big bowl of it for dinner tonight - really! My adjustments to the recipe: 1. 3 cloves of garlic 2. no salt  3. 3 good shakes of HOT chili powder  4. 2 carrots grated  5. add a bouillon cube  6. No lemon  7. garnish soup bowls LIBERALLY w/fresh chopped cilantro AND beautiful, lemon-y sumac","1509379262","4"
"16977152","TimS","Outstanding. Easy. Quick. Added 2 tablespoons of mint to give it a Turkish edge. Will make a bigger batch next time.","1509378509","4"
"17018929","abqdebby","This is delicious!  I upped the chili powder to 1/4 tsp and topped individual servings with the cilantro rather than stirring it in.  The cilantro, olive oil drizzle, and sprinkle of chili powder made for a beautiful presentation!","1509378657","4"
"17094918","Barbara","Wonderful soup. I  decreased the onion by over a half and added celery. Beautiful to look at, also.","1508868920","4"
"17101446","Susan","I also modified the recipe, using some of the modifications mentioned.<br/>I added more lemon juice, actually doubled the amount, toasted pepitas and a teaspoon of plain yogurt<br/>Really delicious<br/>Everyone loved it!","1508868439","4"
"17151449","SB","added chopped cilantro stems and one shallot to onions and garlic<br/><br/>2 tbs tomato paste, three coarsely grated carrots, added 1 tsp each of coriander and smoked paprika along with cumin<br/><br/>crazy how good this is","1508867379","4"
"17188857","Janet B","My husband raved about this soup. I had split pigeon peas in the house so I used them instead of the red lentils and I did not puree at all. The ""Chilly"" powder I used was from an Indian grocery and was very hot. I also added half of a not so spicy jalapeno. I did not puree any of the coup. I will definitely make this again.","1508867395","4"
"17216774","George","One question, is it a quarter liter of broth? I've followed the recipe and I got a yellowy soup. Maybe it was necessary more tomato paste.","1508868265","4"
"17246277","Bob Mc","Followed recipe first time (except we always double the amount of garlic); immersion blender is perfect tool for this. Second time added shredded chicken breast and ground chipotle pepper - made a great meal! Our new go-to soup!","1508868230","4"
"17256801","jmee","All I can do is pile on to all of the 5 star ratings and confirm this is indeed delicious. I cut a bit of the olive oil, didn't use any water and didn't have any cilantro on hand. But still -- wow. Simple and pure.","1508868403","4"
"17297929","Lisa London","I LOVE this soup.  It's easy and feels light and the lemon makes me very happy.  I'm not a cilantro fan so I skip it.","1508868931","4"
"17341637","Cie","It's the sautéing of the tomato paste, I think, that brings so much flavor. I tried it not adding any broth, just water. So flavorful! Simple and wholesome-tasting.","1508868586","4"
"17359386","cre8","I slice up a couple of chorizo and saute first & set aside.  Then I go on to the rest of the recipe.  I also add a heaping tsp. of smoked paprika (pimenton) in step 2, adding the chorizo to the soup in step 3.  I find it's not necessary to puree the soup...it's fine as is!","1508867425","4"
"23097744","Flo","I come from Bulgaria and we also like the Turkish cook very often red lentils. If you use round red lentils, 2 cups of water and 1 cup of vegetable broth should be added, this way you get a very thick and creamy soup. Furthermore, we also add 1/2 tbs of paprika powder together with the other spices. Lastly, we use up to 7-10 tbs of blended whole tomatoes from a can (blend it yourself, it makes a difference). Add the lemon juice to each soup bowl, otherwise the soup will get spoiled faster.","1506874812","4"
"26143592","Mike M","I make this at the start of every week and take it for lunch to work, so I have had time to toy with the recipe. It is wonderful as written but I make the following adjustments: caramelize the onions; add in celery, red pepper with carrots and cook to soften; add tomato paste; add ginger with garlic and spices plus coriander, smoked and hot paprika, turmeric; add 4-5 chopped Yukon gold potatoes with lentils, maybe add extra cup of h2O; use better than bullion veg chicken paste for broth ","1519778500","4"
"29886286","Tef","Made it for the second time tonight. First time according to recipie, but tonight added a slice of bacon before sautéing the onion and garlic, then added a dash of smoked paprika. The first batch was good, but the second was great.","1545704463","4"
"29925132","Babs14","I make this as written every year as part of a buffete for an annual holiday party.  It's a big hit and checks all the boxes - vegetarian (I use veggie broth) and gluten-free, but most importantly, it's delicious.  Make sure to use the lemon - it takes it from a basic to special. ","1546028698","4"
"29960344","Linda","This was delicious!  My husband gave it 5 stars.  I used an extra 1/2 cup of lentils, added a can of diced tomatoes with their juices, garam masala, and a pinch of smoked paprika...oh, and 3 carrots for extra veggies.  Will definitely have this in a regular rotation.","1546362479","4"
"30010837","Heidi","The cilantro and lemon bring a brightness to a delicious winter soup. My middle-schooler likes it for dinner, and I like the leftovers for a healthy lunch that reheats in a microwave without losing any texture or flavor.    Really, what more can a mom ask for? Oh wait--it's healthy, too. (Don't tell my kid, please.)","1546706505","4"
"30016706","Ivy","This worked well in the Instant Pot, cooking for 12 minutes on Bean/ Chili high pressure. It didn't need any blending afterwards, speeding up the whole process. Lemon zest was definitely a nice addition; rather than cumin, I used a mix of coriander powder and oregano, as the soup was preceding an Italian-ish meal. ","1546741320","4"
"30057498","Andrea","Noticed a typo...meant to say it *could've* used more!","1546978211","4"
"30062904","Jana","Wow, one thousand comments on this one recipe. Must be a record. ","1546994590","4"
"30153785","Bill","They took about 20 min for me. I'm using split red lentils--could that be the difference?","1547504852","4"
"30334649","Krausova","Came home late. Had all the ingredients here. Made the soup. Easy and lip-smackingly good.","1548448832","4"
"30345476","quaasam","Delicious. Double spices.","1548524723","4"
"30355313","Tom","I've made a variation of this for years and often like to add Chiplotes in Adobo sauce. They're sold in tiny cans for about $1.50, and it only takes one or two of the chilis and a spoonful of the sauce to amp to the umami flavor. ","1548612555","4"
"30357426","Helen","Wonderful. I followed the directions exactly as presented and I absolutely loved it. The little hit of lemon and cilantro really livens it up. This is a keeper. ","1548631526","4"
"30357820","Carol J","Delicious!  Having a family which does not like spicy hot food, Based on previous comments, I went with the lower amount of chili powder, but added about 1/4 tsp of paprika.  Also added some butternut squash, extra garlic, 1/4 cup extra lentils, two tablespoons of tomato paste, and only one cup of water.  Yum!  A keeper!","1548636782","4"
"30358173","Lisa","We always buy tomato paste in tubes. It seems expensive, but it doesn’t spoil and we can use a spoonful at a time without having to figure out what to do with the rest of a can.","1548640681","4"
"30360832","Flora","Red lentils are actually very high in protein!  A one cup serving has almost 18 grams of protein :)","1548680235","4"
"30366806","Sharon","Omitted the carrot, reduced the liquids, bumped up the spices and added some rice. Made in Instant Pot--10 minutes + quick release.  Creamy and delicious--more like a puree than a soup which is just the way I like it.  Very satisfying. ","1548700249","4"
"30366895","Ragnar","Paul I'm with you in spirit, but in this case (see Roberta's note below) I do think it's fair to nudge Ms. Clark a little. The Recipe-authorship ship sailed the same time as online privacy, but it's out of order for Clark to to write that her soup ""defies expectations of what lentil can be"" when more or less exactly this soup is on offer in restaurants and kitchens around the world. ","1548700574","4"
"30368584","Kim","I respectfully disagree. Olive oil is a great oil and adds much flavor and texture to any dish.","1548706844","4"
"30369333","Melva L","This was easy and very tasty.  Used the Cusinart  for chopping garlic, onion and carrot.  Could have used a bit more spice.  I recommend omitting the both cups of additional water; it seemed a thin.  But the recipe is basically a keeper","1548710028","4"
"30370709","Elizabeth, now of Coastal Maine","I have made this at least a dozen times for our community soup lunches. I double the batch in my 6-quart multi-cooker, and and one-half preserved lemon. I usually puree it all. We are always happy when there are leftovers for us to bring home for ourselves.","1548715982","4"
"30372391","Jane","I added extra lemon and garlic. Was a delicious recipe. Best lentil soup ever. Meat eaters and vegetarian all loved it! Super satisfying for a winter dinner accompanied by salad and fresh baguette. ","1548724552","4"
"30373299","Danielle","My recommendation: double the recipe and then play around with different garnishes. I went classic for bowl #1 with a squeeze of meyer lemon, a glyph of olive oil, a micro-pinch of cayenne and some fresh herb. Other fave toppings for this soup: micro-thin slices of raw shitake (they melt), a streak of toasted sesame seed oil, another streak of tamari and some fresh green herb. I also love a little quartered fresh cherry tomato action in the right season. ","1548729244","4"
"30384688","Walter","-No cumin or other spices,-Replace with a tblsp Korma curry paste; Ditch  tomato paste, carrot, onion.- Replace onion with one leek. Method: Peel & chop fresh ginger root, (1/2 tsp), 2 cloves garlic. Remove base, tops of leek, chop. Add 1 tblsp olive oil. Briefly fry leeks, ginger, garlic. Add Korma paste; fry 2 min, stirring. Add 1 cup red lentils, washed. Sautee mixture 1 min. Add 1 cup chicken broth, 1 cup water, sea salt, dash worcestershire, bay leaf. Simmer 30 min, puree. Divine.","1548785296","4"
"30391009","pam","Very good esp with lemon.","1548809175","4"
"30392380","Emel Kayatekin","Adding some fresh ginger while cooking lentils could be helpful.","1548819266","4"
"30392941","Sandy","Soaking the lentils helps","1548825749","4"
"30424208","Jim Demers","Substitued red curry paste for the tomato paste.  Excellent color and taste!","1548995476","4"
"30449698","Violet","I always put the leftover tomato paste in 1-tablespoon increments into plastic snack bags and freeze them. That way I am ready for all those recipes that ask for just 1 tbsp.","1549163925","4"
"30512726","Partially covered","I don’t have time to read through the 1K notes - so just bumping this up if it’s there already:  The secret to keeping the soup from being too runny is to leave the pot partially covered.  That should be in bold in the recipe because it is important.    Also, for a hearty, comfort-foody addition, add Italian sausage when sautéing the onions.    This is a hit for friends and family.","1549555743","4"
"30558743","changes","2 carrots 4 cloves garlic 2-3 Roma tomatoes  Sautéed until tomatoes are well cooked and oil is red Add spices (cumin and coriander) 1.25 cups lentils Stock  ","1549846326","4"
"31017911","Keith M","Excellent!!...tweaked recipe as follows: 1 1/4 cups lentils, doubled garlic, 5 cups chicken broth, no water, 2 pinches of cayenne...","1552412202","4"
"117022092","sawsan","This is the lentil soul we made in Iraq. The only difference is that we do not add carrots but we add a citrusy flavor by using dried Omani limes.","1645392571","4"
"121991199","Randall Wilkins","A nice traditional mercimek corbasi soup. A couple possible additions might include a small diced potato ( Yukon gold works well here ) added with the carrot.  It adds creaminess and texture. Also , a topping consisting of a garlic clove and  1/ 2 tsp of aleppo chili flakes warmed up on low with 1 Tbsp  EVOO in a saute pan then drizzled on top of the soup at the end  for flavor and color . Don't skip the non traditional  lemon here . A nice touch.","1670972501","4"
"14407331","Carrie","The fresh lemon and cilantro are not just add-ons in this recipe, they brighten all the flavors. This is a very warming, energizing soup.","1509366817","3"
"16744650","Maria","I subbed Garam Masala for the cumin, almost one Tbsp., added zest from the lemon and some celery that I had on hand.  I also used all broth instead of water and didn't bother to purée; I liked it chunky. It was delicious, though it benefitted from a little more salt than the 1/4 tsp. called for. Very flavorful and filling; that kick of lemon juice is lovely.","1509377481","3"
"16806213","Jenn","I enjoyed the soup overall, but my family and I thought that the juice of half a lemon was a bit too much, as it overwhelms the other ingredients. It wasn't a hit with my 3-year-old, who normally likes lentil soup. I skipped the cilantro.","1509378985","3"
"16807853","Sarah","Added corn and doubled the garlic! nom nom","1509378350","3"
"16823415","Jennifer","I was just about done with lentil soup, but I tried this recipe, and it really does defy expectations. I almost didn't add the lemon juice, but I am so glad I did--I think I'll add more next time.","1509378208","3"
"16823612","natalie","quick and easy, mostly outstanding ! you can eat it also with a bowl of basmati rice and a salad. :)","1509378888","3"
"16866249","Jeannie","This soup became an instant family favorite. We often have it with Indian takeout, but it is also comforting on its own with good bread and salad when we just want something simple. Take it for lunch in winter with packed lemon wedges on the side.","1509378518","3"
