"CommentID","UserDisplayName","CommentBody","CreateDate","Recommendations"
"17317290","Holly","This is possibly the greatest thing I have found in the internet. I have lost track of the number of times I've made this soup. I skip the cilantro and add some Aleppo pepper or sumac. Making it again today.","1508868177","15"
"29868685","Karolyn Schalk","I used my Instant Pot to make this last night for the first time. Turned on saute as I started to chop. Used only broth, pressure cooked 15 minutes on high, let the pressure go down about 8 minutes, then quick released. Perfect! If you like harissa a tablespoon instead of cayenne, along with the tomato paste is good.","1545587318","15"
"30383360","Todd","The bulgur and red lentils are what's known as ""vospov khema"" in Armenian cuisine.  Meatless and out of this world.","1548781445","15"
"16865860","A. Spruce","Season with ground sumac when serving....","1509378365","14"
"17053519","Northstar5","I found this easy to make but it lacked flavor. After pureeing half the soup (which I recommend), I added the following: another half-lemon's juice; 1 tsp curry powder; another 1/2 tsp cumin; 1 tsp sugar (this helped a lot); 1/8 tsp cayenne pepper; another heavy pinch of chili powder); and tripled the amount of cilantro suggested. <br/><br/>I can't eat really spicy food but these additions did not make it spicy at all. The changes just gave it depth and flavor.","1509378609","14"
"30128459","readerbrook","Based on a Julie Sahni recipe, I add 2 teaspoons of ground coriander, a 14-oz tin of fire-roasted diced tomatoes, usually the juice of a whole lemon, and often a 10-oz pacakage of frozen kale or spinach, defrosted and squeezed dry.   It's a fantastic pantry soup, one that I'd been chasing the remembrance of for 20 years. It also freezes very well, if you want to make a big pot.","1547355265","14"
"30356031","Walter Sudmant","Add grated ginger with the onion and garlic for a fresher taste.  ","1548616600","14"
"30390063","Smithsmath","This is basically daal w chicken stock. Only difference from indian daal is the chicken stock. ","1548804131","14"
"30407924","Johanna","Water to red lentil ratio from Bob’s Red Mill bag simple: one cup lentils to 3 cups water. Works for this soup. Really nice soup with the help of those who went before me. Bumped up to 4 cloves garlic and 2 carrots. Added Turmeric and Grated Ginger. ","1548905211","14"
"30347619","Dagmar Degree "," Very delish, but thinner though I watched the liquids. I would increase lentils to 1 1/4 cups next time. But flavor awsome, everything in house. How can any one eat canned soups?? ","1548546446","13"
"16782055","wilcoworld","Just made this as a Thanksgiving starter -- will be great as a vegetarian meal on it's own.<br/>Leftover potato soup as broth.  Red lentils cooked faster than expected. Reduced heat, added water as needed.  Added small chunks potato early on.  Cumin & cayenne as directed.  Grape tomatoes instead of tomato paste.  Lovely color!  Fragrant !  No blending<br/>Lemon juice to taste when serving. Cilantro & olive oil drizzle, imperative. Herb hesitant husband:<br/>""Best soup ever.""","1509376748","12"
"16811107","Jane Eyrehead","I caramelized the onions a bit, and added cumin to them.  I also heated the chili pepper with the onions.  Delicious, quick, easy, and a bit fancier than the regular lentil soup.","1509379222","12"
"16879441","Elizabeth","This is most delicious. I did tinker a bit though; I made a double batch and ended up adding a 3rd cup of lentils to make it thicker. I also added some dried lemon peel which I often do to highlight the lemony flavor.","1509379057","12"
"16938088","SCA","For people who dislike cilantro and also avoid dairy, you can make a very simple chutney that adds a nice zing.  My most useful kitchen tool is the mini electric food chopper made by Oster or Black & Decker, and it makes this chutney a breeze:  blend green chilies, a ripe tomato and any green herb of your choice i.e. parsley, mint etc., with a bit of salt.  Can be left a little chunky if you prefer.  Add a little lemon juice if the tomato isn't flavorful enough.","1509378229","12"
"17100951","Ben P","This recipe is very flexible.  I have made it three times and varied the level of cumin and chile powder each time.  I also went with more than 1 carrot and more broth and less water in one iteration.  All three came out well.  My favorite variation though was to add some left over holiday ham.  The bit of pork made a huge difference.  I could see using bacon in place of ham for an equally delicious option.  Very few soups that are so easy to get right.  This recipe is a keeper!","1508868895","12"
"17152846","Margaret","Excellent, easy soup.<br/><br/>I  used 2 Tbsp tomato paste and an extra carrot. Adding grated Parmesan cheese just before eating really deepened the flavor.","1508868269","12"
"17215845","Sky","Made as written the first night and it was very good but I could not help myself so on night two, I added more tomato, cumin, tumeric and cayenne. Really good. I did use all vege broth because I needed to get it out of the freezer.","1508868433","12"
"30347978","Betsy Dain","Great! Used 1 qt of broth, no water; added quite a bit of minced ginger with the garlic (after the onion was soft-ish); added some roasted butternut squash. Totally delicious but the squash made it sweet - really good but different. No  cayenne, just a pinch of chili powder.","1548550295","12"
"30383868","Gene","Reminder- lentils alone are not a complete protein. Add a whole grain and you’re in business.","1548782923","12"
"30403481","Mardee","I loved this soup - I had seconds and will be making it again very soon. The lemon juice really makes a difference. The only change I made was to just plop the immersion blender into the pan (instead of removing half the soup) and give it  few whirls. I liked it - it was a little chunky but still smooth and with much less work. ","1548882062","12"
"16212287","Doren","This soup is so tasty and good, it's hard to believe how easy it is to make.  Bright, delicious flavors!  I've made it several times and it never ceases to amaze me (and it freezes nicely as well).  The only changes I'd recommend is to add Aleppo pepper if you have it, lemon zest if you feel like it, and it's even simpler when I just purée the soup in the pot with the immersion blender, don't bother to take out half, just blend a couple of short spurts.","1509374567","11"
"30346092","kathleen sweazey","why do the garlic bits not get burned and become bitter?","1548529567","11"
"30360025","ste","No meat is necessary from a nutritional point of view, lentils are actually very rich in protein. I sometimes add chopped onions sautéd in a bit of oil on top of it before serving.","1548674228","11"
"30369171","Blythe","Try “Better than Bouillion “ brand vegetable broth.  ","1548709386","11"
"30392956","Pat","It doesn’t have iodine added so it tastes better.","1548826038","11"
"16899386","Janice","Great soup; I make it at least once a month in the winter and everyone (even non-lentil-soup-eaters) love it. Like others, I add only 1 cup of water. And I skip the puréeing--I just chop the carrot and onion finer, which makes for a nicely textured soup.","1509378060","10"
"16910680","Cindy","This soup was amazing. I added Tumeric and took about 3/4 cup out to process in my small Cuisinart, added it back and it really thickened the soup. ","1509378257","10"
"22158020","JenS","I started making this in my Instant Pot after Melissa mentioned it in her Instant Pot article. Comes out beautifully at 10 min high pressure with   a quick pressure release. I saute in the inner pot and use an immersion blender at the end so I only have one dish to wash.","1506865179","10"
"30346625","Jane","Can you tell me, please, why you feel it's necessary to use KOSHER salt?","1548535298","10"
"30356020","Mari","All of those would significantly change the recipe. I hate to waste the rest of the can of tomato paste too so I spoon it into a freezer bag in little 1 tbsp balls, make sure they aren't touching & freeze. Then over the next few months you can grab 1 or 2 and drop them in other dishes--really boosts the flavor of jarred sauces & soups! Also, there are tubes of concentrated tomato paste, really good! refrig after opening, and not expensive when you consider they are double strength.","1548616553","10"
"30391802","Esther","Added more cumin and cayenne.  Next time will purée more and add cilantro.  This is a keeper.  Great with a salad of fennel, orange, and kalamata olives.","1548814525","10"
"16866499","SCA","Also note that although the red lentils do cook relatively quickly, it's best to soak them ahead of time.  Can be done while you sautee the vegetables and seasoning, though when I make daal I put the lentils to soak earlier in the day.<br/><br/>I use fewer spices than when making other South Asian dishes because the red lentils have a delicious, delicate taste and aroma of their own.  Legumes like split peas can use more liberal seasoning.","1509379009","9"
"17013895","Steve","Made the soup.  Loved it.  My wife says that her Grandmother made it for Lent and called it Caldo de Jocobo.  She says it is a very old Mexican recipe. Could also be Spanish. Her Grandmother was from Spain.  I used hot smoked paprika (La Chinita Brand-very HOT) Will make again.  Steve","1509378156","9"
"17246278","Schlattastic","Doubled my batch with a bit more carrot, and used Aleppo Pepper since I had some on hand. Easy recipe. Very tasteful. Will be a keeper, and lots of future possibilities for adapting this. <br/><br/>I tried batch of Ottolenghi's Quick-Pickled Lemons from 'Jerusalem' and used them to great success as garnish with a dollop of Greek yogurt (and the recipe's lemon squeeze & cilantro). Made a guest-worthy presentation of a humble, tasty soup.","1508868226","9"
"25166047","Duygu","The consistency of this soup is just right for Turkish style lentil soup. My grandmother's recipe is 1 cup lentils -rinsed well-, 1 medium carrot and 1 small potato for 7 cups of liquid. I didn't have any broth so I only used water and replaced olive oil with ghee. It was delicious. If you have a middle eastern market near by I'd recommend tying this with Turkish style tomato paste. While you are there, also get some dried mint leaves to serve the soup with.","1512850905","9"
"29707189","sadah","I can’t believe how much of a hit this was. The lemon was such an incredible treat. Cool news: I did not have red lentils but green ones worked just fine! I was so devastated that I wouldn’t be able to follow it to the letter but it was a treat. I served it with coconut rice. Biggest note is do not skip the blending! My mom tried to “whisk” these (whatever that means mom) and the texture from a blender or immersion blender makes it so much more rich. I added the ginger like many commenters did. ","1544554644","9"
"29867487","Norman Berns","A few other minor changes. Substitute kidney beans for the lentils. And instead of cooking on the stove, bake for 40-45 minutes until golden brown. And, of course, top with a nice slice of sharp blue cheese. ","1545583184","9"
"30023853","Lacey","Loved this amazing soup and many additions suggested below! -carmelized onion and carrots for about 20 min -added a teaspoon of ginger -roasted garlic before adding -upped lentils to nearly 2 cups -upped carrots to 2 -added entire can of crushed tomatoes, skipped paste -added entire can of Coconut cream -used mint and cilantro for garnish ","1546802948","9"
"30353016","Jonathiggins","Is there a trick to preparing lentil dishes to reduce gas? I love lentils and this recipe sounds delicious, but I usually regret having them afterwards (and so does my family!)","1548602991","9"
"30364303","Heather N","This was delicious and so easy!! Even easier if you buy pre-diced onion/carrots/garlic.  I didn’t have one large carrot, so used 3 medium - I could have used more, but we really like carrots in soup.  I didnt think it was spicy at all, so you could definitely add more than a pinch of chili powder.  I didn’t think it was too thin as some people have said - it is only thin if you don’t blend half the soup.  Be careful not to go overboard with lemon at the end.  Cilantro makes a huge difference. ","1548692146","9"
"30369195","LGM","I reluctantly put in the 2 cups of water with the 1 quart of chicken broth. I found the soup lacked ""depth"" so next time I would add only additional chicken broth, which is what I normally do with soups. I did add a 1/2 cup extra lentils and more carrots. The lemon (added zest as well) and cilantro added nice flavors.","1548709492","9"
"30390877","Anita","     Have been making red lentil soup for years. Add a chopped parsnip and mushrooms, preferably fresh shiitake for a more robust flavor. And, a cinnamon stick gives it a Middle Eastern touch.","1548808401","9"
"30397835","Kevin","Why is it that carnivores can't stand to eat any vegetable dish without adding ham?  Never mind, I saw a bumper sticker yesterday that stated ""bacon is a vegetable""","1548864880","9"
"16809003","Krista","Very yummy. Onion benefits from sautéing for some extra minutes if you have the time. I also added some more garlic and cumin.","1509378853","8"
"17004130","Naz","Great recipe. Threw in some garam masala and turmeric.","1509378879","8"
"17144369","Skiely","Really liked this on an El Nino night in California. I made part during my lunch break (and soaked the lentils and sauteed veggies in a little Tequila, just because). Loved it with the Cilantro fresh in my bowl, left it out of the pot since my husband is one of the cilantro/soap genetically defective people.","1508867522","8"
"17212997","TS","I take this soup to lunch and add the cilantro after I reheat it. Drizzle is F.Olivers Meyer Lemon Olive Oil... Very awesome!","1508868427","8"
"30126606","Ana Swanson","Top with yogurt ","1547340811","8"
"30133265","AAAKaye","I made this last night for the first time to serve to guests (living on the edge!). And I doubled the recipe. Only modification was adding fresh ground pepper to the soup in the bowl. Rave reviews and lots of compliments for me! Served it at half-time with Greek salad, pita and hummus. The Meyer lemon, cilantro, and fresh ground pepper are key to making this a fantastic soup.","1547394591","8"
"30354086","Eileen","Substitute some of the water with coconut milk. You can’t go wrong with it!","1548607217","8"
"30357844","Barbara","Just eyeball it.  It doesn't really make any difference if it isn't exactly half.","1548637076","8"
"30357940","Claudia ","This is pretty much Milk Street's recipe for Turkish lentil soup.  I like theirs better.","1548638073","8"
"30359086","miriam","few changes...used chicken stock, and, instead of water, one 14oz. can of diced tomatoes and more stock. I used 3 carrots instead of 1, and didn't bother to blend....and added a bag of spinach, finished with grated parm, and it was fabulous.","1548651692","8"
"30363538","Bill E","Skipping the use of any oil will be of greater benefit, and go for the veg broth. There is no ""good"" oil. Well, 10W-30.","1548690103","8"
"30373321","Frank","Smoked paprika was a nice add. ","1548729393","8"
"30374451","Chrissy","This was very watery without much flavor. I would add fresh ginger in with the garlic and onions, add turmeric with the cumin, (or perhaps curry powder), omit the extra 2 cups water, and possibly use some coconut milk instead of some of the broth. And once done, a dollop of yogurt.","1548734821","8"
"30390445","jwrt","I prefer to sauté the garlic first until golden and only then add the onion. Then saute the two. The garlic won't burn. In this way the garlic flavour is tastier. Only adds two minutes to prep time.","1548806241","8"
"30392693","MClaire","This was sublime. And easy to make. The spices were terrific. And the lemon cilantro and drizzle of olive oil was an excellent finish. Along with french bread, this is a keeper!","1548822424","8"
"30393142","Mojo007","I always made that soup and it is extremely good for cold winter nights. I also add a pinch of coriander and fresh turmeric in Step 2. It gives it a more hearty flavor and vibrant color. ","1548830399","8"
"30396622","Martin R.","because the shape of the salt crystals is taken into account for the amount called for in the recipes. Kosher salt (by volume?) is less dense than table salt or fine sea salt. If you use fine salt, you might need to reduce the amount of salt you use, although it’s usually to taste anyhow. The previous reply is also important. Kosher salts do not have the mineral aftertaste of iodized table salt. ","1548860880","8"
"30400162","Catherine","I cook the soup with a big slice of lemon in the pot. ","1548872125","8"
"16744932","GS","Lisa, that does not sound yummy to me. Maybe the reason why this recipe has some many reviews is that it is actually pretty good. Maybe your technique needs some improving and the recipe is not to fault. I loved it personally and have made it a dozen times.","1509377618","7"
"16877332","SCA","About salt, everyone:  you want to be precious about it, be my guest.  You think sea salt is a supremely natural choice that makes Diamond Crystal look and taste like mud?  Have you been following the state of our oceans?  Remember the awful oil spill off the coast of Brittany?  The plastic nations drifting hither and  yon on the tides?  You think none of that gets into, in some degraded elemental form, that expensive sea salt?<br/><br/>Food writers write on food.  They always need new topics.","1509378098","7"
"16932115","SCA","There's no substitute for the particular taste and aroma and texture of red lentils.  They are delicate and less ""gritty"" than other kinds.","1509378653","7"
"16937346","Merle","This is my go-to dish for people of all ages, all stages, tastes and all seasons. The recipe is too easy for words, and never fails. What more can I say.... try it! You'll like it!","1509378651","7"
"16944687","Anwar","As everyone is noting, the recipe is versatile. I subbed coconut milk for tomato paste, added fresh ginger, more garlic, a bunch of curry spices, and more carrots. Lemon OR lime for a hit of acid--this is a great recipe! I make variations and bring to work almost every week.","1509379053","7"
"17281830","Mitch","This recipe is INCREDIBLE. It freezes well. I served it with a dollop of plain Greek yogurt and some hot sauce. Delicious, easy. One of my favorites.","1508868733","7"
"25352960","Judy Richman","I've made this recipe many, many times now, and it's a favorite. It's an easy, fast recipe, and always delicious.","1514402538","7"
"29598404","Cook from Chapel Hill","Very delicious. I made a batch of this right before my husband and I came down with bad colds.  It must be the spices and heat, but it seemed to clear up our sore throats very quickly.  Best restorative soup since I lived in NYC where I relied on Chinese hot and sour.  This one is every bit as healing!  I did bloom extra cayenne in a little bit of oil to add.  Also, I agree with other cooks who added 3 carrots, full can of tomato paste and doubled spices.  This is now a favorite recipe. ","1543818447","7"
"29867508","Susie","Strangely, this exact recipie is on the back of my package of red lentils, including the addition of lemon juice. These lentils come from Twin Falls, Idaho. ","1545583322","7"
"30126813","Jessica","Made for dinner tonight with some changes: -doubled the recipe -2 cups of red lentils and 8 cups of veg broth, no additional liquid for a t h i c c stew -I didn’t have carrots, so instead I used about 10 ounces of chopped sweet potatoes -blended with an immersion blender -After blending, I added 1 bunch of dinosaur kale, which I had stemmed and sliced. I cooked the soup for about 5 minutes to wilt the kale -Served with shaved parm, chives, cherry tomatoes, olive oil drizzle","1547342435","7"
"30137046","Beth","I’ve made this many times; it’s well loved at our house. I like it thicker, so I use 1.5 cups lentils and only 1 cup water. I also used 2 Tbsp tomato paste because I was using one of those little 2T packets, so why not use it all. I think adding rice or some squash or sweet potato would be delicious. ","1547415709","7"
"30332505","Jeanne","I cook red lentils for 5 to 10 minutes in the instant pot, depending on how mushy (for soup) or firm I want them. ","1548444508","7"
"30345411","Nick","The soup is wonderful.  I add some red onion chutney (chopped red onion in vinegar) in the bowl for a nice, crunchy zing.","1548524127","7"
"30358456","Marilyn Showalter ","Per Melissa CLark’s recipe for a slightly different Red Lentil soup in her Instant Pot cookbook (“Dinner in an Instant”), pressure cook for 6 minutes, then cool naturally for 10 minutes. This is after first sautéing everything but the lentils, carrots, and stock. We made the original soup this way, today, and it was excellent. ","1548643854","7"
"30358934","LKF","Sprinkle with powdered Sumac before eating.  ","1548649511","7"
"30391914","Hans","Yes, it will keep for at least a week, probably improve in the refrigerator. We make a big pot of lentil soup and eat it all week, lovely when reheated.","1548815508","7"
"30405317","JeffB","Wonderful soup!  I added about a tablespoon of ground cardamom in step 2 (I think you could add whatever spice you think tastes good).  Needs crusty bread with good butter to be perfect!","1548889858","7"
"31263259","k@","Make sure to put the lid on partially covered, as I forgot last night and my lentils came out watery wheras the first time the soup was quite thick. It really makes a difference. Also the lemon and cilantro do give it something. I didn't measure my spices but I think I put more than the recipe says. This is a great soup I really really like it and will make it often!","1553710434","7"
"16151946","Eva","Loved this!  Doubled the recipe, added more carrots and some celery to give it some extra chunkiness, reduced water by two cups.  Will be making it a lot this winter!","1509374258","6"
"16929392","Christopher","Mine is similar, only I useMINT, vs. cilantro.  Mine gets close to the old Bereket Turkish joint that used to be on Houston St.","1509378532","6"
"17106410","Elizabeth","This recipe is exactly like the soup I enjoyed so many times in Istanbul.  It is delicious and so simple to make.  I made it for a party and got a lot of positive feedback.","1508868370","6"
"17174867","kathleen","I swooned when I first had this soup at a dinner party.  When the hostess forwarded the recipe, she said she did not use the cilantro - and I haven't either.  I have served at dinner parties, to my grand-kids who LIKE IT - Eureka- they don't like much, to friends recovering from surgery.   It is the all purpose, go-to soup and that freezes well.","1508868803","6"
"17180955","Katherine","FWIW, I also upped the quantity of lentils by almost 50%: I used almost 3 cups for a double recipe. I liked the final texture of the soup that way. Think it would have been watery with fewer lentils.","1508868886","6"
"17249190","Lea G","Excellent!  I doubled the garlic, and instead of a teaspoon of cumin I used a rounded tablespoon!  It's a keeper!  Delicious, nutritious and inexpensive!!! Plus it's not a lot of work!! Melissa Clark hits yet another home run!","1508867826","6"
"30064192","Ed Hawco","..or less water. I've been making this for a couple of years and I generally add only 1/2 cup of water instead of the suggested 2 cups. (Sometimes a bit more; depends...). ","1547000773","6"
"30137583","Elizabeth","Used 2 tsp cumin, 1 tsp paprika, 1 tsp chili powder, 1/2 tsp each salt and pepper, 1 cup water in addition to broth, 6 cloves garlic, and zested 1 lemon into pot. Juice of 1 lemon at end, no cilantro.  Next time will increase chili powder to 1 Tbsp. Also possibly add poultry sausages before simmering.  Could also double recipe. It served 3 for dinner plus 1 lunch size portion.","1547424657","6"
"30352766","Ellen ","Delicious, but the quart of stock is enough liquid: there's no need for 2 cups of water, which thins it out and adds no flavor.","1548602162","6"
"30361176","Barbara Boettner","This is really not a classic Indian recipe, unless all lentil recipes are, arguably, also Indian--this is a classic Turkish recipe, served in most Turkish restaurants, which I have been offering as part of my oriental mezze buffets for over twenty years.  The Indians have dozens of similar dishes, most of them more purees than soups--but mostly spiced differently, and with different lentils.  My favorites for Dals are Chana Dal (chickpeas) and Toor Dal (southern Indian).  ","1548681995","6"
"30367251","vicki","sounds good but it is a different soup!!","1548701918","6"
"30368918","maryanne","Made as stated except instead of adding the lemon and cilantro to the pot, I added a squirt of lemon, a tiny drizzle of olive oil, a pinch of chopped cilantro with a dust of ancho chili powder to each separate bowl.  It is light, bright flavorful and quite beautiful. ","1548708302","6"
"30391612","Pam","Had the same issue, but got the texture right by cooking it down some more without the lid.  A night in the fridge thickened it more, and the color brightened as well.  Was great spooned over leftover basmati rice, too, for a more substantial soup.","1548813111","6"
"30393029","Mary Ellen","Before adding the lentils to the soup, put them in a separate pot with water and bring to a low boil for two or three minutes.  Drain, rinse, and then add to the soup. ","1548827358","6"
"30400139","Catherine","I leave out the tomato paste and use a pint of my husband's canned tomatoes. I made this soup all the time.","1548872063","6"
"30405648","annie","Added more garlic, cumin, chili powder, salt. Used three carrots and tossed in two small redskin potatoes, pared and diced. Used broth and stock—no water. ","1548891555","6"
