"CommentID","UserDisplayName","CommentBody","CreateDate","Recommendations"
"16865220","SCA","This is daal, minus a few essential seasonings.<br/><br/>Best made by sautéing the onions, then adding ginger and garlic paste to taste; sautéing fresh chopped tomatoes (no paste); adding spices (turmeric, coriander powder, chili powder, a touch of cinnamon if you like) once the oil has taken on the red color from the tomatoes and the vegetables have a glazed appearance.<br/><br/>Not enough salt in this recipe.  <br/><br/>Make a simple chutney with yogurt, green chilies and cilantro.","1509378895","1751"
"17062143","Jackie","Was looking forward to this making this, and after seeing the comments, made a few changes...used chicken stock, and, instead of water, one 14oz. can of diced tomatoes and more stock. I used 3 carrots instead of 1, and didn't bother to blend....and added a bag of spinach, finished with grated parm, and it was fabulous.","1509378170","1638"
"16889061","Michael","This is a very tasty recipe but I have two suggestions:<br/>1. There is too much liquid for the amount of lentils; therefore add one or two small potatoes, diced, to give the soup more body.<br/>2. Step 4 - No need for more mess of moving half the soup into another pot; get the same rougher consistency by pureeing in one pot but in short bursts until somewhat, but not entirely smooth.","1509378176","947"
"14309009","LL","This recipe makes 4 small bowls of soup. Double the recipe to serve 4-6","1509367493","708"
"17180922","SBDeb","Absolutely delicious! I will never buy lentil soup again. This soup is better than any I've had at any Persian, Arabic or other mediterranian restaurant.<br/>I did add an extra 2 cloves of garlic, extra 1/4 c of lentils, an extra carrot, and used 1/4 tsp chili powder, 1/4 tsp cayenne, and 1/4 tsp of kebab spices ( mostly coriander and cumin)<br/>Consistency and flavor were perfect!","1508868742","513"
"16984677","Mahvash","I followed the suggestion to use 2 carrots, 3 garlic cloves, and 5 cups of chicken broth, 1.5 cup red lentil and no water.  I grated my carrots and sauteed it with the garlic and onion.  I normally don't like red lentils, but this was fantastic. The lemon really rounded the soup. Will make this again.","1509378106","496"
"16871080","SCA","Jules:  for this quantity (1 cup lentils), a couple of plum tomatoes should do.  Important to get nice juicy ripe tomatoes, and to sauté all the vegetables until the oil rises to the top and takes on the red tomato color, otherwise it will retain a somewhat raw taste no matter how long you simmer the soup.  That first step ensures the full release of flavor of the spices.","1509378262","419"
"17104418","Jean","I ate this soup almost every day in Turkey, where sumac and/or mint are added at the end. Sumac is not hard to find in the US (Whole Foods carries it), and adds a lovely tartness more mellow than lemon. The mint is also a nice touch.","1508868191","413"
"16908995","Randy","You'll get more color out of the carrot and the tomato paste than the lentils. Red lentils fade rapidly to pale pink and then yellow as they are exposed to prolonged heat. But forget their color, it's the flavor and texture that makes them so desirable. If you want more red bump up the tomato or add some sweet smoked Spanish paprika--the subtle smoke note is terrific with lentils of all hues.","1509378364","330"
"16059500","MJ","We like to zest the lemon as well.  The brightness of flavor this adds is incredible.  The flavor just explodes in your mouth!","1509374845","314"
"17242954","Gary","I make this all the time. At the end I often add fish (a pound of tilapia works nicely) to make a rich one-pot dinner - like a thick chowder. (The fish cooks in the hot soup.) I like things spicy so I then adjust the seasonings (including the amount of lemon) accordingly; and I let the volume reduce a bit by not covering the pot tightly when simmering.","1508867434","304"
"16879637","Isabel","Just made this for the first time, and it was delicious. I understand that some people do not like cilantro, but it really does benefit from that flavour, as well as the lemon juice. Keep those two ingredients in there, and you won't be sorry! I followed the recipe exactly, and didn't find it too thin. I have leftovers, and keep going back to the pot for another spoonful. I will say that it gets thicker as it cools. Highly recommend, and will definitely make again.","1509379226","236"
"16933021","Zoe","After I used the immersion blender, I added a bunch of lacinato kale torn into small pieces and cooked for a few more minutes until wilted. Delicious!","1509378764","222"
"14912778","Katy","I have made this soup at least 3 dozen times, always yielding the same delicious results. It freezes beautifully making it a great option for make-ahead menu item or impromtu dinner party. In addition to the cilantro, I like to garnish with toasted pepitas. It's so good I've served it as light lunch item on Thanksgiving.","1509369081","204"
"14322464","Carey Larsen","This is such an easy, healthy, inexpensive soup. I add two tablespoons of barley to give it a little silkiness. Also use ground chipotle pepper. I cook this in my pressure cooker for about 9 minutes, which results in no need for the immersion blender step.","1509366661","183"
"17054047","Val","This is a wonderful soup with the following amendments: double the spicing, use three carrots instead of one, and use an entire small can of tomato paste. Salt to taste. I also add a dollop of plain yogurt on top at the end when served with the cilantro.","1509379228","109"
"16522575","Anita","This soup is wonderfully delicious.  For a variation I add 1 teaspoon of curry powder to the spices and then serve the soup with a dollop of yogurt.  I also saute the carrots with the onion and garlic to bring out more sweetness.  Yummm!","1509375438","101"
"17133431","Sally","After reading all the comments, I used sumac & mint at the end, to make it more like the Turkish version.  Served it with crustini with tomato/basil/buffalo mozzarella, to bring in another Mediterranean flavor.  Fabulous and fun weeknight dinner!","1508868010","86"
"17172990","Nancy","Delicious. But I followed the advice of others here and added a lot more spices: 1 extra TBS of tomato paste, 1 tsp smoked paprika, 1tsp smoked coriander, an additional tsp of salt. Also let it simmer an extra 10 minutes which thickened it up a bit.","1508867359","79"
"30348469","H","I add smoked paprika to this recipe - a wonderful addition to a wonderful dish.","1548554564","75"
"17091484","Elle","No, coriander and cumin are not the same. You may be thinking of cilantro and coriander. Coriander is the seed of the leafy green herb. Cumin is something else altogether.","1508868744","70"
"30260201","Barbara","This soup is tasty but I only put half of the water in as it is really too thin.  I added chickpeas for some bulk.  Wondering if the recipe meant to use two rather than one cup of lentils.  ","1548094130","67"
"30359124","Roberto","I buy those pre roasted grocery store chickens for a few dollars. First night I pick all the meat off the bones and eat the dark meat. The rest of the meat goes in the fridge. The bones, juice at the bottom of the container, fat, any skin I don't eat right away goes into the pressure cooker for a good long blast. The stock goes into the fridge. Next day I make Melissa's red lentil soup using the reserved stock. The chicken meat can be added to the lentils after they are done. Vegans beware.","1548652309","67"
"17107866","JayNYC","Wow, delicious. Of course made some changes, some taken from the Cooks Illustrated version I just saw in my email. Used both cumin and coriander - both toasted and ground fresh. The coriander has some natural lemon essence. Added a pinch of cinnamon and also a squirt of harissa (and went easy on the chile powder). I also sautéed the carrots with the onion, but that was only because I goofed. Only change for next time - less liquid as others have also suggested. Maybe a bit more tomato paste too.","1508867593","63"
"17139661","Mal","This was amazing! My family absolutely loved it too. I doubled the recipe for 4 eaters and had a nice lunch left over. I also added 2 stalks of celery, 1 russet potato and about 1/3 cup of tomato sauce. I put lemon zest in before simmering and then added the lemon juice about 5 minutes before serving. Delicious!","1508868579","61"
"30358793","Debra","I make this soup in the Instant Pot and set it for pressure cook for 12 minutes. I also add 1/2 cup more lentils and add another 1/2 teaspoon of cumin to the recipe. ","1548647829","60"
"16935896","James Ferrell","This is one of my favorite soups.  I think it is even better with toasted cumin seed (dry roasted in a small frying pan until the seeds begin to pop) in place of the ground cumin, but it's good either way.","1509378767","58"
"17172334","Deb","Thanks to all of you who sent comments.  I'm taking them into account.  <br/><br/>Melissa--given all the trend in the comments-too watery, etc. --is this a recipe that would benefit from revision and reissue,  or do you like the watery quality of the soup?<br/><br/>-Deb","1508867440","54"
"16796268","Juliet Jones","When salt is added to a dish such as this one, can you really distinguish different types of salt? I can't.","1509377195","52"
"16253992","Davida","Super easy, yummy soup. Great for weeknight or make ahead meals. Was a big hit served w a dollop of Greek yogurt and fresh parsley (instead of cilantro). <br/><br/>Used Aleppo pepper instead of cayenne/chili and blended right in the pot using an immersion blender (no need to remove half and dirty another dish) but otherwise followed recipe. Will definitely make again. Doesn't make a lot (3 main course servings) so would double next time and maybe add an extra carrot or two.","1509375453","50"
"17540464","AGA","We love this soup. Have made it four times now. A few things I do differently that I think improve the flavor are:<br/><br/>1. I use crushed tomatoes instead of tomato paste<br/>2. I use cumin seed in addition to ground cumin, tsp. or so of each. The seed adds a depth of flavor.<br/>3. I don't purée because the lentils fall apart as it is, why dirty more utensils?<br/>4. I use rainbow carrots & 1.5x the amount in the recipe.<br/>5. I top the bowl of soup with chopped fresh cilantro and yoghurt.","1508870710","41"
"30345133","Sri","So I just watched Milk Street Kitchen's lentil soup. I love Melissa's recipe. But I have to say the finishing touch on the MSK's recipe would be fabulous on this. Heat 1/4 cup extra virgin olive oil and toast 1 Tbsp Aleppo pepper (or use a combo of smoked paprika and chilli flakes). Let the pepper steep into the oil. Drizzle on the soup. It's a 'tarka' style topping that takes this soup over the top. ","1548521589","41"
"30377353","Errol","A billion Indians eat this at every meal.  Its called ""dal"" or pronounced daahl.  Its the vegetarians' main source of protein.  Utterly delish.  So glad its coming to everyday American tables.","1548765528","41"
"30359129","miriam","- 3 more cloves of garlic - 1.5 cups of red lentils - 1 teaspoon of grated ginger (would add more next time) - Zest of one small lemon - Juice of two small lemons + served with lemon wedges. - More salt, pepper and cayenne - Used just one quart of chicken stock...no extra water. - Used an immersion blender","1548652419","33"
"30173948","Tracie","Usually stick to original recipe. Only difference, I added celery and carrot to the sauté, extra chile powder, and blended the ENTIRE pot with my hand held  $20 immersion cuisinart blender (can't live without).The soup became instantly more flavorful after blending. Loved the consistency of it not being too thick (nice change) and since there are 5 of us to feed I doubled the recipe and made a huge salad to go with.  So good I inhaled two cups before the rest of my tribe got home:) Party!!!","1547591252","32"
"30249949","Sarosh S","I dust it with sumac, and on top of that add a tablespoon of sumac when adding cumin. Ooh lala","1547998676","32"
"30347791","Dagmar Degree ","Ok , ate 2 bowls of this soup. I was swooning.  Such simple ingredients and relatively short prep and cooking time. It tastes as if some chic chef made it instead of moi! I love lots of your recipes, Melissa, but you've outdone yourself with this one. And it's vegan, for all our veganistas. I used veg stock. Well I cheated a bit, water with 'better than boullion', always on hand. Will make this for my son who loves my go to lentil soup, which is very good, but this is awesome. Thank you!","1548548519","32"
"30331931","Pam","Can use1 can chopped or crushed tomatoes instead of tomato paste, or whole can of tomato paste","1548442800","31"
"30358118","Lisa","Actually, this is a soup I’ve often found in Turkish restaurants. (I think the traditional soup might have sumac in it, which has a lemony flavor, but I’m not sure.) The order in which the ingredients are added in this recipe isn’t consistent with Indian cuisine, and broth isn’t a typical Indian ingredient.","1548640172","30"
"17042262","Wendy","Based upon the other comments, I only used broth and skipped the water.  Soup came out excellent!","1509378119","27"
"30154331","robyn b.","I tend to follow recipes exactly, instead of trusting my instincts.  This soup was super watery and as I was pouring in the 2 cups of water, I had a bad feeling.  Yes, the soup was full of flavor, but if I make it again, I will not add all of the water and I will add more tomato paste and possibly a sweet potato or some other vegetable.  ","1547506945","27"
"30260043","Robin","Made this as the tundra like temperatures descended near Boston. Light, spicy and bold as promised. Love the color. Doubled ingredients (quadrupled spices after reading notes here) to make more servings. Didn't quite have enough tomato paste on hand so added two tablespoons of adobo sauce from can of chipotles in adobo sauce. I roasted my carrots first and added those sautéed chicken sausage, after blending all with immersion blender and let simmer a bit more to release their flavors. A keeper!","1548093105","27"
"24448012","Jasmine","Instant Pot version: Sautéed two med onions, 5 minced garlic cloves, and spices and tomato paste in pot, added two large carrots, two celery ribs, homemade vegetable stock + water (as per recipe), and pressured cooked on high for 10 minutes.   Then stirred in one bunch of ribboned lacinato kale, replaced lemon with 1.5 tsp of sumac, added heaping 1/2 tsp of yellow miso (instead of more salt), covered lid while pot was still hot to allow kale to wilt down a bit. Served with fresh mint. Delicious!","1507952955","26"
"30378026","Nadine","This is very Turkish, especially if you leave out the cilantro and give people sumac to sprinkle on top.  My mother-in-law would put in a handful of rice along with the lentils.  It binds the soup and makes it silky.  Not too much, or it gets a bit gummy.  For 7 C. water (no broth), I use about 1/4 C. of rice, and 1 1/2 C. red lentils.  I haven't tried garlic, but that sounds good.  I usually add a small stalk of celery, chopped, which maybe isn't authentically Turkish, but gives it more umami.","1548767881","24"
"16796393","M.Lussini","This is a lentil soup if you add too many flavors you are missing the whole idea. I usually wait until the last 12 minutes to apply the Cumin as it tends to give a slight bitter taste if you cook it longer. Cilantro is very powerful when cooked I don't use it I like to taste the lentils. Finally try using  about 15% of a cup to a cup lentils ratio of Egyptian Rice if you don't like to add carrots.","1509377563","23"
"30348588","Dennis II","Great flavors!  Added about a quarter tsp of chipotle chili powder rather than ""a pinch"" and that zipped it up a bit.  Maybe a tad more salt would be good.  But we loved the result - will do this one again soon.  Perfect for a cold January evening in frozen Michigan. ","1548555680","23"
"30377405","Errol","PS. must add turmeric powder.  Its the champion deodorizer of flesh - fish, meat, chicken as well as foul smelling veg like cabbage cauliflower etc.","1548765700","23"
"16879564","Cristina","Simple and good. However the lemon and cilantro are a must as they bring the favors together. I had no fresh cilantro but reached for my frozen cilantro cubes. You can buy herbs in little cubes in the frozen section of your (high end) supermarket- they come in so handy, especially in winter! I also added a pkg of frozen cauliflower pieces, which gave it a tad more hardiness without changing the favors. Great for a chilly day.","1509378159","22"
"30253929","Feltchy","So I added half a teaspoon of coriander and a pinch of both cardamom and tumeric for the fuller curry effect. Had half an apple laying around so I diced that up  and threw it in as well. With the addition of the lemon juice and cilantro it turned out  to be really complex and wonderful! Spicy, a little sweet and a little sour. Love this and will continue to make it for family and friends!","1548022002","22"
"17249350","Jan Priddy","I have made a similar recipe for years. Sometimes I use more carrots and also yams or red potatoes; sometimes I use a can of coconut milk, 2 tablespoons of currants, and a healthy dose of curry powder; sometimes I serve over rice.","1508867377","21"
"26209946","Mrs B","Actually this is a Turkish style soup called Mercemek. Not to take away from my own South Asian heritage, but this is not dahl. It is a simple and very elegant soup that doesn't need to be muddled with more spices. The lemon and herbs (dill or mint also work) make it tasty just fine. If you want to add another element, some extra virgin olive oil over the top won't hurt. I am all for changing things up but the simplicity of this soup should not be mistaken for lacking anything.","1520267415","21"
"29973803","Courtney","I always seem to prefer lentil soup with WAY more lentils than recipes call for, so I went ahead and added the full pound. (That's 2 cups and a little more.) I left everything else the same except that I added a little chopped candied ginger with the garlic, a pinch of turmeric, and a can of full-fat coconut milk when I pureed 1/2 of it. The finished soup was creamy and silky with just enough texture from the un-pureed veggies, and the color was gorgeous. Definitely putting this one in my rotati","1546480444","21"
"30025942","Suzanne","Very good but needed some tweaking.  Added the following:  - 3 more cloves of garlic - 1.5 cups of red lentils - 1 teaspoon of grated ginger (would add more next time) - Zest of one small lemon - Juice of two small lemons + served with lemon wedges. - More salt, pepper and cayenne - Used just one quart of chicken stock...no extra water. - Used an immersion blender  Next time I will most likely serve with a dollop of yogurt or sour cream. ","1546823306","21"
"19855632","JL","Is it possible to recheck the fat content for one serving in the Nutritional Analysis??? It's difficult to imagine that 31g of fat per serving can result using these ingredients.","1508884286","19"
"30135896","trowe2","Delicious! Cooked lentils 6 minutes in the instant pot with a 10 minute natural release. Added a bit of sumac at the end. Sprinkled with Za’atar and olive oil for serving ","1547405074","19"
"30245707","CB","I LOVE this recipe - make it probably twice a month at least. That said, I make modifications: Triple the carrot, cumin and chili powder. Add some cinnamon and nutmeg, and a few small potatoes along with carrot that blend in really nicely at the end. I think it's too liquidy as written, so I either just do broth, or use a can of cream of chicken soup mixed with water to suffice for liquid. I also just found myself without tomato paste, so substituted with a bit of sriracha sauce. Yum!","1547960221","19"
"30321012","Wendy","This is amazing! I double or triple the garlic, and add more hot pepper - just depends how spicy you like your food. We crumble good tortilla chips on top, along with the cilantro, yogurt and lemon. Delish!","1548383917","19"
"30357488","Roberta Barr","Melissa, I think you need to start referencing the inspiration for ""your"" recipes.  This is Indian Dal.  If you cite your inspiration for recipes, you'll get less credit, but it would be more honest.   ","1548632470","19"
"30377232","Wendy","I add 1/2 cup of bulgur at the same time as the lentils.  It gives the soup a nice body.  Also substitute a 15 1/2 oz can of diced tomatoes for the tomato paste.","1548764941","19"
"16864572","Lisa","This is similar to my favourite recipe from a vegetarian cafe in Victoria, Canada called ReBar.   Their's is spiced with oregano and rosemary, with crumbled feta overtop. It's incredibly fast, easy, and delicious!    The whole ReBar cookbook is awesome, it's made my goal to eat more veg and less meat much easier!","1509379250","18"
"17262789","David","I really wanted this to be a carrot soup with lentils so I increased the carrots to six and sliced them thinly, Didn't bother to puree at all. One of the best soups I've ever made.","1508868267","18"
"30357146","Saritha","This is actually a recipe for indian dal.  Better to call it such, rather than soup.","1548627659","18"
"30369493","Molliela","Really wishing I'd read through the comments before making this. Following the recipe exactly made a thin, watery, and unappetizingly yellow gruel. Added another 1/2 cup of lentils and cooked for another 15 minutes to give it an edible consistency. Next time, I'll add more fresh tomato and carrots, maybe some fennel. The lemon and cilantro are what makes this soup notable.","1548710675","18"
"30380083","Dave ","I first had this soup in Damascus in the early 1980’s and have loved it and made it at home ever since. Most restaurants in the middle-east serve with pita bread fried croutons which are delicious but, well, fried. So my variation is to cut up thin pita piece in postage stamp size, toss in a bit of olive oil and oven bake until a deep rich brown color and lightly salt if desired. Garnish the soup and keep a bowl in the middle of the table for eveyone to replenish the soup topping.","1548773698","18"
"30396345","BKB","This really is the best lentil soup ever. Even my husband, not a big lentil fan, loves this soup. I took the advice of another commenter and added a bit more water and tomato paste and a quarter cup of basmati rice, which gave it more body and a silkier texture. This is the perfect comfort food for the polar vortex.","1548859954","18"
"30369997","Steve","I haven't made this recipe yet, but I have cooked with red lentils a lot. My initial take on reading the recipe is that I would add turmeric, probably a teaspoon or more. I'd do that at the same time as the other spices, and I would probably increase the other spices as well. (Measurements? I don't need no steenking measurements!) While I'm at it, I would probably use lime rather than lemon.","1548712787","17"
"30392453","John Luker","My wife said, ""I've had many good lentil soups, but this is the best, by far."" I agree. I went a little heavier with the cumin and chili powder--a heaping teaspoon of each. I used about 3/4 tsp salt. I also used the juice from a whole lemon, albeit a small lemon. We tend toward bolder seasonings, so this may not be to everyone's taste, but for us it was perfection.","1548819904","17"
"30423397","Tom Banerjee","This is also known as ""Masoor Daal"" in India.  It is daily soup every Indian eats every single day for centuries.  Mostly in West Bengal, India.  Bengali people loves this soup in Kolkata.","1548990834","17"
"16878512","Irene B","I found this to be a bit thin with only one cup of red lentils, so I added 2/3 of a cup more and the texture was perfect. Sprinkled in garam masala at the end instead of chili powder. This is fast, easy, and freezes beautifully.","1509379014","16"
"30011265","Colleen","Unconventional for New York Times Cooking, I am sure, but I received an Instapot and decided to use my go to recipes in it. Using saute function, I add onion and garlic. I follow the recipe as is, with the exception of a bit more cumin and cayenne. Once the lentils, broth and water have been added, the pot is sealed and set to high pressure for 10 minutes. Once allowed to depressurize, open and stir vigorously. This thickens soup and melds ingredients without immersion blender. Flavorful.","1546708483","16"
"30348630","Dennis II","Add more garlic, double the tomato paste. At least 1/4 tsp chipotle chili powder. Maybe extra half cup lentils & cup broth. ","1548556038","16"
"30358135","Lisa","This is, in fact, a traditional Turkish soup. Though similar in some ways to dal, it is a legitimate Turkish dish. I often order it in Turkish restaurants.","1548640328","16"
"30359693","Eliza Bell","Instead of chili powder I added a tablespoon of harissa and it was DELICIOUS. Yum.","1548667875","16"
"30380118","AA","Without the cilantro, but with an added toasted ground coriander and garlic finish, this delicious soup is an Egyptian staple. Its low cost makes it so popular, that it's the regular meal served in Egyptian jails and some public schools.  ","1548773758","16"
"30408120","Jane","I grated the carrots rather than diced. They cooked more quickly and added even more sweetness to offset the lemon juice. Also no need to blend. ","1548906656","16"
"16865336","Judy Epstein","I am lazy too, and would never pour soup from the pot, to the blender, back to the pot...(and what if there's more in the pot than fits in the blender?); but using an immersion blender right in the pot is almost sinfully easy.","1509379070","15"
"16935657","regularmeg","added diced butternut squash for a lovely addition. this soup is fantastic.","1509379012","15"
